"Food, Varietal, Parts, Form (pear, Bartlet, whole without seeds, fresh) ",water content, Detailed Sample Description,Simple name,glycan_food_class,Unique Identifier Code,Mass of weighed sample,Glucose,Galactose,Fructose,Xylose,Arabinose,Fucose,Rhamnose,GlcA,GalA,GlcNAc,GalNAc,Mannose,Allose,Ribose,
"Apple, envy, whole without seeds, fresh",0.807946907,"Apple, envy, whole without seeds, fresh, 80.7946907461471",Whole envy apple w/o seed,Fruits,1,10.23,0.045520232,0.001676431,0.024157398,0.00122357,0.001991591,0.000362404,0.000136166,0,0.002397399,0,0,0,0,5.86E-05,
"Apple, envy, peel only, fresh",0.740186852,"Apple, envy, peel only, fresh, 74.0186851921563",Envy apple skin only ,Fruits,2,10.29,0.043722915,0.005732777,0.016875903,0.002998504,0.005309282,0.001097191,0.000353606,0,0.00709134,0,0,0.001020026,0,0,
"Apple, envy flesh only, fresh",0.807884603,"Apple, envy flesh only, fresh, 80.788460311044",Envy apple flesh only ,Fruits,3,10.07,0.036137483,0.001788018,0.020516195,0.001432412,0.001416467,0.000455698,0.000127565,0,0.001815491,0,0,0,0,0,
"Apple, jazz, whole without seeds, fresh",0.852902479,"Apple, jazz, whole without seeds, fresh, 85.2902478816904",Whole jazz apple w/o seed,Fruits,4,10.26,0.025297832,0.001420374,0.018067106,0.001736192,0.001011001,0.000478802,0.000149598,0,0.002270892,0,0,0,0,0,
"Apple, jazz, peel only, fresh",0.807859409,"Apple, jazz, peel only, fresh, 80.7859409323896",Jazz apple skin only,Fruits,5,10.18,0.02613381,0.003795737,0.016262972,0.003012764,0.004183861,0.001044092,0.000389661,0,0.006910528,0,0,0.000512055,0,0,
"Apple, jazz, flesh only, fresh",0.867020936,"Apple, jazz, flesh only, fresh, 86.7020936039439",Jazz apple flesh only ,Fruits,6,10.17,0.023987428,0.000879258,0.017287012,0.001370615,0.000606783,0.000304655,0.000108112,0,0.001763036,0,0,0,0,0,
"Apple, honeyscrisp, whole without seeds, fresh",0.857306629,"Apple, honeyscrisp, whole without seeds, fresh, 85.7306628902825",Whole Honeycrips apple w/o seed ,Fruits,7,10.29,0.024301537,0.000992432,0.019624905,0.000909956,0.00114968,0.000340752,0.000114725,0,0.001504274,0,0,4.94E-05,0,0,
"Apple, honeyscrisp, peel only, fresh",0.826830128,"Apple, honeyscrisp, peel only, fresh, 82.6830128404589",Honeycrips apple skin only,Fruits,8,10.27,0.031350674,0.00224203,0.018729707,0.001854476,0.003069955,0.000573365,0.000273262,0,0.003885239,0,0,0.000191353,0,0,
"Apple, honeyscrisp, flesh only, fresh",0.868573605,"Apple, honeyscrisp, flesh only, fresh, 86.8573605406122",Honeycrips apple flesh only,Fruits,9,10.41,0.020331532,0.000845466,0.020563237,0.000891597,0.000798021,0.000302018,0.000104484,0,0.001243819,0,0,0,0,0,
"Apple, pink lady, whole without seed, fresh",0.841354651,"Apple, pink lady, whole without seed, fresh, 84.1354651280905",Whole Pink Lady apple w/o seed ,Fruits,10,10.01,0.02727875,0.001665935,0.021138699,0.001434313,0.002434889,0.000462927,0.00018149,0,0.002984595,0,0,0.000307931,0,0,
"Apple, pink lady, peel only, fresh",0.785769157,"Apple, pink lady, peel only, fresh, 78.5769156904168",Pink Lady apple skin only,Fruits,11,10.47,0.02255915,0.002529209,0.014895685,0.001894015,0.004400944,0.000486518,0.000299495,0,0.006374439,0,0,0,0,0,
"Apple, pink lady, flesh only, fresh",0.845235176,"Apple, pink lady, flesh only, fresh, 84.5235175830104",Pink Lady apple flesh only,Fruits,12,10.42,0.028676065,0.001832416,0.023707804,0.001492861,0.002398545,0.000603119,0.000173956,0,0.002392045,0,0,0,0,0,
"Apple, fuji, whole without seed, fresh",0.838135888,"Apple, fuji, whole without seed, fresh, 83.8135888182601",Whole Fuji apple w/o seed ,Fruits,13,10.18,0.021869298,0.000375363,0.020845832,0.001068789,0.001050822,0.00025267,0.000115247,0,0.001529778,0,0,0,0,0,
"Apple, fuji, peel only, fresh",0.777418448,"Apple, fuji, peel only, fresh, 77.7418447694038",Fuji apple skin only,Fruits,14,10.21,0.042262672,0.005960734,0.043722585,0.003866464,0.006072692,0.000780594,0.000591844,0,0.010181103,0,0,0.000608983,0.000100384,0,
"Apple, fuji, flesh only, fresh",0.837095313,"Apple, fuji, flesh only, fresh, 83.7095313360209",Fuji apple flesh only,Fruits,15,10.15,0.029275113,0.001457834,0.029829151,0.001934819,0.001321483,0.000350571,0.000160298,0,0.001701377,0,0,0,0,0,
"Apple, gala, whole without seed, fresh",0.855378989,"Apple, gala, whole without seed, fresh, 85.5378988701926",Whole Gala apple w/o seed ,Fruits,16,10.08,0.025490755,0.001688016,0.023345447,0.002825895,0.001657501,0.000646167,0.000214907,0,0.002437587,0,0,0,0,0,
"Apple, gala, peel only, fresh",0.788181621,"Apple, gala, peel only, fresh, 78.8181620682164",Gala apple skin only,Fruits,17,10.23,0.028546551,0.005694737,0.04057254,0.004712112,0.006206702,0.000914632,0.000690952,0,0.010081496,0,0,0.000241049,9.76E-05,0,
"Apple, gala, flesh only, fresh",0.854396827,"Apple, gala, flesh only, fresh, 85.4396826573738",Gala apple flesh only,Fruits,18,10.3,0.031631125,0.001692491,0.022360716,0.002782477,0.001316544,0.00058416,0.000153175,0,0.002120856,0,0,0,0,0,
"Apple, golden del, whole without seed, fresh",0.847044496,"Apple, golden del, whole without seed, fresh, 84.7044495523002",Whole Golden Del apple w/o seed ,Fruits,19,10.07,0.028301204,0.001571465,0.022327221,0.001239704,0.001884106,0.000324419,0.000178193,0,0.002701041,0,0,0,0,0,
"Apple, golden del, peel only, fresh",0.784252442,"Apple, golden del, peel only, fresh, 78.4252441773103",Golden Del apple skin only,Fruits,20,10.26,0.03268856,0.005357228,0.028887304,0.00373006,0.00690198,0.000875935,0.000507007,0,0.007596903,0,0,0.000781222,0,0,
"Apple, golden del, flesh only, fresh",0.850695858,"Apple, golden del, flesh only, fresh, 85.0695858385034",Golden Del apple flesh only,Fruits,21,10.34,0.024430039,0.001588745,0.013808991,0.001196225,0.001862868,0.000745177,0.00015229,0,0.002069355,0,0,0,0,0,
"Apple, red delicious, whole without seed, fresh",0.811795095,"Apple, red delicious, whole without seed, fresh, 81.1795095138691",Whole Red Delicious apple w/o seed ,Fruits,22,9.99,0.033777322,0.002897038,0.020817721,0.001793028,0.002854127,0.000348932,0.000161856,0,0.002604944,0,0,0.00013946,0,0,
"Apple, red delicious, peel only, fresh",0.729523933,"Apple, red delicious, peel only, fresh, 72.9523933487358",Red Delicious apple skin only,Fruits,23,10.22,0.040644439,0.009217824,0.018201957,0.004608642,0.012509518,0.001123287,0.000691337,0,0.010552894,0,0,0.000641028,0,0,
"Apple, red delicious, flesh only, fresh",0.815556461,"Apple, red delicious, flesh only, fresh, 81.5556461173681",Red Delicious apple flesh only,Fruits,24,10.4,0.044169985,0.002690109,0.028877034,0.001930939,0.002728658,0.000414445,0.000174115,0,0.002458817,0,0,0.00015567,0,0,
"Apple, granny smith, whole without seed, fresh",0.858050154,"Apple, granny smith, whole without seed, fresh, 85.80501538663",Whole Granny Smith apple w/o seed ,Fruits,25,10.12,0.031325918,0.002171407,0.015751465,0.002254589,0.001888359,0.000531318,0.000175734,0,0.003061148,0,0,0.000354307,0,0,
"Apple, granny smith, peel only, fresh",0.796200624,"Apple, granny smith, peel only, fresh, 79.6200624260037",Granny Smith apple skin only,Fruits,26,10.3,0.036785991,0.005244981,0.014606097,0.004587728,0.007825081,0.001170827,0.000528656,0,0.011789998,0,0,0.000856976,0,0,
"Apple, granny smith, flesh only, fresh",0.858792468,"Apple, granny smith, flesh only, fresh, 85.8792468157948",Granny Smith apple flesh only,Fruits,27,10.3,0.032016407,0.002957168,0.024526054,0.002934434,0.002126021,0.000593495,0.000209834,0,0.003535978,0,0,0.00030289,0,0,
"Apple, pazazz, whole without seed, fresh",0.854656572,"Apple, pazazz, whole without seed, fresh, 85.4656571813545",Whole Pazazz apple w/o seed ,Fruits,28,10.34,0.029714883,0.00198292,0.032830174,0.001803712,0.001608952,0.000397514,0.000166418,0,0.002003995,0,0,0.000235892,0,0,
"Apple, pazazz, peel only, fresh",0.81071115,"Apple, pazazz, peel only, fresh, 81.0711150131694",Pazazz apple skin only,Fruits,29,10.49,0.024820879,0.002853151,0.028674043,0.002210137,0.003328077,0.000301726,0.000257054,0,0.004514728,0,0,4.49E-05,0,0,
"Apple, pazazz, flesh only, fresh",0.857378502,"Apple, pazazz, flesh only, fresh, 85.7378502141908",Pazazz apple flesh only,Fruits,30,10,0.019563391,0.001644711,0.011613383,0.001288157,0.001309693,0.000466658,0.000139341,0,0.001557855,0,0,0,0,0,
"Pear, red d'anjou, whole without seed, fresh",0.836192865,"Pear, red d'anjou, whole without seed, fresh, 83.6192864635455",Whole Red D'anjou pear w/o seed,Fruits,31,10.25,0.01834427,0.001789921,0.016378912,0.020721766,0.0038801,0.000213277,0.00030763,0,0.002812241,0,0,8.49E-05,0,0,
"Pear, red d'anjou, peel only, fresh",0.771842077,"Pear, red d'anjou, peel only, fresh, 77.18420772587",Red D'anjou pear skin only,Fruits,32,10.28,0.016884143,0.004674956,0.013487556,0.033119404,0.008130408,0.00068995,0.000820228,0,0.007035706,0,0,0.000526817,0,0,
"Pear, red d'anjou, flesh only, fresh",0.848752512,"Pear, red d'anjou, flesh only, fresh, 84.8752511721366",Red D'anjou flesh skin only,Fruits,33,10.39,0.017048617,0.001418399,0.01980722,0.006889474,0.001864882,0.000330627,0.000232467,0,0.002736823,0,0,0,0,0,
"Pear, bartlett, whole without seed, fresh",0.808866905,"Pear, bartlett, whole without seed, fresh, 80.886690506643",Whole Bartlett pear w/o seed,Fruits,34,10.21,0.017699307,0.001380554,0.010086858,0.003115661,0.003669564,0,0.000202601,0,0.00271753,0,0,0.000558109,0,0,
"Pear, bartlett, peel only, fresh",0.712145986,"Pear, bartlett, peel only, fresh, 71.2145985990835",Bartlett pear skin only,Fruits,35,10.44,0.023195564,0.002406172,0.005967502,0.006012119,0.008215641,0.000768282,0.000380831,0,0.004668416,0,0,0.000673578,0,0,
"Pear, bartlett, flesh only, fresh",0.825535871,"Pear, bartlett, flesh only, fresh, 82.5535870516185",Bartlett flesh skin only,Fruits,36,10.47,0.026840783,0.000882614,0.036384145,0.001400075,0.002470238,0.000202553,0.000133116,0,0.001896425,0,0,0,0,0,
"Pear, d'anjou, whole without seed, fresh",0.843945713,"Pear, d'anjou, whole without seed, fresh, 84.3945713339954",Whole D'anjou pear w/o seed,Fruits,37,10.44,0.020943109,0.001043847,0.017961536,0.002533385,0.001815223,0.000165261,0.000161516,0,0.002567717,0,0,4.37E-05,0,0,
"Pear, d'anjou, peel only, fresh",0.774244766,"Pear, d'anjou, peel only, fresh, 77.4244765755658",D'anjou pear skin only,Fruits,38,10.35,0.020600617,0.003864252,0.01356044,0.02921205,0.006439894,0.000475666,0.000584029,0,0.004547388,0,0,0.000637081,0,0,
"Pear, d'anjou, flesh only, fresh",0.850032389,"Pear, d'anjou, flesh only, fresh, 85.0032389368552",D'anjou flesh skin only,Fruits,39,10.26,0.049985854,0.005500212,0.0157409,0.000466999,0.00314677,7.26E-05,0.000475397,0,0.006581629,0,0,0.00032213,0,6.43E-05,
"Pear, beurre bosc, whole without seed, fresh",0.854842676,"Pear, beurre bosc, whole without seed, fresh, 85.4842676311031",Whole Beurre Bosc pear w/o seed,Fruits,40,10.4,0.01812086,0.001474508,0.047429575,0.014191596,0.001548974,0.000258525,0.000313395,0,0.002668137,0,0,0,5.20E-05,0,
"Pear, beurre bosc, peel only, fresh",0.783904193,"Pear, beurre bosc, peel only, fresh, 78.3904192673298",Beurre Bosc pear skin only,Fruits,41,10.32,0.024855556,0.002322598,0.016697291,0.009520317,0.0035269,0.000304911,0.000352668,0,0.004874257,0,0,0.000471089,0,0,
"Pear, beurre bosc, flesh only, fresh",0.855305997,"Pear, beurre bosc, flesh only, fresh, 85.5305996744247",Beurre Bosc flesh skin only,Fruits,42,10.16,0.016389345,0.000959321,0.018479161,0.002806774,0.001041218,0.00026971,0.000122556,0,0.00198607,0,0,2.52E-05,0,0,
"Pear, shingo, whole without seed, fresh",0.824538098,"Pear, shingo, whole without seed, fresh, 82.4538097626439",Whole Shingo pear w/o seed,Fruits,43,10.05,0.03775133,0.000956969,0.025259671,0.00162004,0.002541741,0.000170374,0.000197395,0,0.002459976,0,0,6.58E-06,0,0,
"Pear, shingo, peel only, fresh",0.73621724,"Pear, shingo, peel only, fresh, 73.6217240290496",Shingo pear skin only,Fruits,44,10.45,0.026026654,0.002646532,0.0110401,0.003739648,0.00632129,0.000185703,0.000377737,0,0.006044846,0,0,0,0,0,
"Pear, shingo, flesh only, fresh",0.835659855,"Pear, shingo, flesh only, fresh, 83.5659855028515",Shingo flesh skin only,Fruits,45,10.24,0.03663224,0.001264269,0.024714621,0.002989183,0.001356792,0.000309124,0.000154151,0,0.001043396,0,0,0,0,0,
"Banana, plaintain, flesh, fresh",0.672891838,"Banana, plaintain, flesh, fresh, 67.2891838365588",Plantain banana (steamed 10 in),Fruits,46,10.29,0.255047542,0.001870404,0.002712054,0.00054856,0.001143243,0.00027935,2.88E-05,0,0.002943319,0,0,0,0,4.58E-05,
"Banana, yellow, peel only, fresh",0.891797145,"Banana, yellow, peel only, fresh, 89.1797145424283",Yellow banana peel only,Fruits,47,10.23,0.026219716,0.001200835,0.00322596,0.001287614,0.002019714,8.79E-05,8.54E-05,0,0.00264794,0,0,0.000391694,0,0,
"Banana, yellow, flesh, fresh",0.759402696,"Banana, yellow, flesh, fresh, 75.9402696060177",Yellow banana flesh only,Fruits,48,10.47,0.14142887,0.001227287,0.018338086,0.000403722,0.000670063,0.000123186,3.06E-05,0,0.002467325,0,0,0.000803114,0,0,
"Banana, red, flesh, fresh",0.736667675,"Banana, red, flesh, fresh, 73.6667674947723",Red banana (steamed 10min),Fruits,49,10.24,0.135110813,0.001553924,0.008342105,0.001001453,0.001191579,8.08E-05,8.87E-05,0,0.002941159,0,0,0.001168932,0,0,
"Aprium, interspecifc, whole, fresh",0.87934337,"Aprium, interspecifc, whole, fresh, 87.9343370493813",Whole interspecific aprium,Fruits,50,10.26,0.032442275,0.001144549,0.009882381,0.000835788,0.001623314,0.0001764,0.000172177,0,0.002235043,0,0,9.91E-05,0,0,
"Apricot, regular, whole, fresh",0.861474769,"Apricot, regular, whole, fresh, 86.1474769185677",Whole apricot,Fruits,51,10.08,0.031314183,0.001743202,0.007752287,0.001441909,0.002149635,0.000259458,0.000210974,0,0.002947817,0,0,9.00E-05,0,0,
"Plum, black, whole, fresh",0.844784202,"Plum, black, whole, fresh, 84.4784202177124",Whole black plum,Fruits,52,10.45,0.03613253,0.003695999,0.014540616,0.000877435,0.001911327,0.000198521,0.000185949,0,0.003083672,0,0,0,0,6.46E-05,
"Plum, red, whole, fresh",0.82907745,"Plum, red, whole, fresh, 82.9077450269848",Whole red plum,Fruits,53,10.01,0.04776499,0.004752843,0.014064875,0.001241923,0.00188801,0.000343896,0.000255871,0,0.002685193,0,0,0.000277578,0,0,
"Pluot, flavor gator, whole, fresh",0.862113082,"Pluot, flavor gator, whole, fresh, 86.2113081929746",Whole flavor gator pluot,Fruits,54,10.08,0.038559801,0.003393673,0.011139608,0.000901229,0.001564603,0.000184493,0.000174013,0,0.001822589,0,0,0.000145471,0,0,
"Plum, black, whole, fresh",0.841121594,"Plum, black, whole, fresh, 84.1121594402629",Whole black plum (HGO farms),Fruits,55,10.01,0.035305324,0.003779241,0.012020264,0.001203027,0.002056204,0.000296785,0.000236093,0,0.003477054,0,0,0.000315533,0,0,
"Pluot, plumogranate, whole, fresh",0.873382363,"Pluot, plumogranate, whole, fresh, 87.3382362569016",Whole Plumogranate pluot,Fruits,56,10.43,0.034646764,0.002484871,0.007042979,0.001051813,0.001495101,0.000208159,0.000200816,0,0.002166554,0,0,8.29E-05,0,0,
"Nectarine, white, whole, fresh",0.856362891,"Nectarine, white, whole, fresh, 85.6362891057676",Whole white nectarine (HGO Farms),Fruits,57,10.19,0.045021759,0.002235712,0.017502613,0.001451453,0.002855075,0.000415255,0.000192905,0,0.003020832,0,0,0.000117639,0,0,
"Peach, saturn, white, whole, fresh",0.844365757,"Peach, saturn, white, whole, fresh, 84.4365756766993",Whole white saturn peach,Fruits,58,10.32,0.058280044,0.00181454,0.019324637,0.001160409,0.002699787,0.000306133,0.000209951,0,0.003273455,0,0,7.59E-05,0,0,
"Peach, white, whole, fresh",0.861436738,"Peach, white, whole, fresh, 86.1436738195824",Whole white peach,Fruits,59,10.32,0.049065805,0.001526829,0.015686331,0.000675773,0.002628407,0.000243179,0.000178608,0,0.003246953,0,0,0.000153528,0,0,
"Nectarine, yellow, whole, fresh",0.834058747,"Nectarine, yellow, whole, fresh, 83.4058747123032",Whole yellow nectarine,Fruits,60,10.04,0.046935322,0.00165095,0.013211247,0.000769801,0.002696048,0.000187182,0.000160963,0,0.003300903,0,0,9.66E-05,0,8.00E-05,
"Peach, yellow, whole, fresh",0.902534405,"Peach, yellow, whole, fresh, 90.253440523232",Whole yellow peach (Prima Farms),Fruits,61,10.23,0.029818722,0.001393855,0.012800254,0.001100094,0.001402432,0.000217056,0.00012037,0,0.002114126,0,0,6.56E-05,0,5.85E-05,
"Nectarine, yellow, whole, fresh",0.87346176,"Nectarine, yellow, whole, fresh, 87.3461759631973",Whole yellow nectarine (overipe),Fruits,62,10.09,0.044741771,0.001572238,0.019483726,0.000987251,0.001975388,0.000225744,0.000189301,0,0.003427035,0,0,2.70E-06,0,6.38E-05,
"Nectarine, yellow, peel only, fresh",0.849012023,"Nectarine, yellow, peel only, fresh, 84.9012023000523",Yellow nectarine peel only ,Fruits,63,10.11,0.035587564,0.002540826,0.01600699,0.001528904,0.004755819,0.000421256,0.00033474,0,0.00911907,0,0,0.000279026,0,0.000104786,
"Nectarine, yellow, flesh only, fresh",0.889628879,"Nectarine, yellow, flesh only, fresh, 88.9628879300031",Yellow nectarine flesh only,Fruits,64,10.4,0.038924914,0.001068061,0.016892962,0.000878885,0.001412088,0.000159155,0.000100879,0,0.00245057,0,0,8.44E-05,0,4.58E-05,
"Peach, yellow, whole, fresh",0.838944871,"Peach, yellow, whole, fresh, 83.8944871264718",Whole yellow peach (HGO Farms),Fruits,65,10.29,0.056496851,0.002054258,0.022550939,0.001038322,0.002384421,0.000373487,0.000151231,0,0.002935874,0,0,5.30E-05,0,6.94E-05,
"Nectarine, white, whole, fresh",0.862872687,"Nectarine, white, whole, fresh, 86.2872686543282",Whole white nectarine (Summeripe),Fruits,66,10.37,0.052157745,0.001432706,0.023183429,0.000598561,0.001964349,0.000178951,0.000124786,0,0.002644226,0,0,9.63E-05,0,4.17E-05,
"Nectarine, yellow, whole, fresh",0.813363363,"Nectarine, yellow, whole, fresh, 81.3363363363363",Whole yellow nectarine (HGO Farms),Fruits,67,10.2,0.064647385,0.001773235,0.017707524,0.00066312,0.003365992,0.000239268,0.000210899,0,0.004014927,0,0,0.000277529,0,4.74E-05,
"Apple, golden del, whole without seed, fresh",0.852723667,"Apple, golden del, whole without seed, fresh, 85.2723667086699",Pureed whole golden dell apple w/o seed,Fruits,68,10.36,0.023179086,0.001764518,0.018824566,0.001334765,0.002183666,0.000553317,0.000197645,0,0.002710621,0,0,0.000253021,0,0,
"Pear, bartlett, whole without seed, fresh",0.807528941,"Pear, bartlett, whole without seed, fresh, 80.752894145082",Pureed whole bartlett pear w/o seed,Fruits,69,10.03,0.022522578,0.001850224,0.024115661,0.005929263,0.004856237,0.000365118,0.000274656,0,0.002872823,0,0,0.000450767,0,0,
"Apple, honeyscrisp, whole without seeds, fresh",0.881272957,"Apple, honeyscrisp, whole without seeds, fresh, 88.1272957488686",Pureed whole honeycrisp apple w/o seed,Fruits,70,10.4,0.027353167,0.00169376,0.020476972,0.001174448,0.001957215,0.000454131,0.000213234,0,0.002738202,0,0,0.000344546,0,0,
"Mango, yellow, flesh, fresh",0.765272286,"Mango, yellow, flesh, fresh, 76.5272286162809",Yellow mango,Fruits,71,10.22,0.111942116,0.009661627,0.039369002,0.002665333,0.006720489,0.001135613,0.000436359,0,0.004907218,0,0,0.001045477,0,0,
"Mango, red, flesh, fresh",0.884990541,"Mango, red, flesh, fresh, 88.4990541499172",Red mango,Fruits,72,10.1,0.016922492,0.001355616,0.006443175,0.001291441,0.002243259,0.00048327,0.000133296,0,0.002285813,0,0,1.83E-05,0,0,
"Avocado, hass (large), flesh, fresh",0.565163838,"Avocado, hass (large), flesh, fresh, 56.5163838273246",Hass (large) avocado,Fruits,73,9.86,0.009189393,0.001790655,0.01345644,0.001724995,0.0051215,0,0.000587029,0,0.012332823,0,0,0.000124363,0,0,
"Avocado, hass (small), flesh, fresh",0.730023608,"Avocado, hass (small), flesh, fresh, 73.0023608240353",Hass (small) avocado,Fruits,74,10.48,0.003871731,0.0017157,0.006042612,0.001630117,0.004266167,0,0.00046031,0,0.009173528,0,0,0.000295624,0,0,
"Tomato, green house (large), whole, fresh",0.939580639,"Tomato, green house (large), whole, fresh, 93.9580638839898",Whole Green house (large) tomato,Vegetables,75,10.43,0.015957116,0.000638995,0.008583779,0.000215637,0.000323062,3.83E-05,9.35E-05,0,0.002204098,0,0,0.000727087,0,0,
"Tomato, Glorys, whole , fresh",0.914774647,"Tomato, Glorys, whole , fresh, 91.4774647119734",Whole Glorys tomato,Vegetables,76,10.48,0.018426574,0.00138406,0.007386822,0.000820805,0.000731574,3.36E-05,0.000145224,0,0.002636276,0,0,0.000132525,0,0,
"Tomato, Twilights, whole , fresh",0.891857385,"Tomato, Twilights, whole , fresh, 89.1857384912775",Whole Twilight tomato,Vegetables,77,10.39,0.024874856,0.001609811,0.007102699,0.001141445,0.00104974,8.45E-05,0.000149453,0,0.002908387,0,0,0.000409752,0,0,
"Tomato, Comets, whole , fresh",0.911461921,"Tomato, Comets, whole , fresh, 91.1461920982855",Whole Comets tomato,Vegetables,78,10.15,0.020628044,0.002109243,0.006853556,0.000994106,0.001062634,8.86E-05,0.000146796,0,0.002235055,0,0,0.001841858,0,0,
"Tomato, Cherubs, whole , fresh",0.894585008,"Tomato, Cherubs, whole , fresh, 89.4585007745325",Whole Cherubs tomato,Vegetables,79,10.11,0.027159435,0.002784853,0.01001337,0.001615906,0.001630454,8.67E-05,0.000190169,0,0.00295921,0,0,0.001402336,0,0,
"Berry, blueberry, whole, fresh",0.848932081,"Berry, blueberry, whole, fresh, 84.8932080594648",Whole blueberry,Fruits,80,10.1,0.047474,0.002107246,0.0071437,0.002536733,0.000924838,0.000371627,0.000106805,0,0.002025217,0,0,0,0,0,
"Berry, raspberry, whole, fresh",0.82646168,"Berry, raspberry, whole, fresh, 82.6461679581872",Whole raspberry,Fruits,81,10.09,0.053140384,0.002235,0.045391724,0.001714038,0.00143655,0.000209114,0.000238095,0,0.002221985,0,0,0.000316013,0.000145078,0,
"Berry, blackberry, whole, fresh",0.847351162,"Berry, blackberry, whole, fresh, 84.7351162120843",Whole blackberry,Fruits,82,10.11,0.039804406,0.002515653,0.014806327,0.001513971,0.003318433,0.000359488,0.00028698,0,0.004265619,0,0,0.000493666,0,0,
"Berry, strawberry, whole, fresh",0.874968955,"Berry, strawberry, whole, fresh, 87.4968955117971",Whole strawberry,Fruits,83,10.13,0.031546958,0.001415226,0.004307445,0.000985245,0.001005375,0.000586771,0.000164541,0,0.002350709,0,0,2.39E-05,0,7.00E-05,
"Berry, goldenberry, whole, fresh",0.790216806,"Berry, goldenberry, whole, fresh, 79.0216806146919",Whole goldenberry,Fruits,84,10.39,0.050579148,0.001601904,0.017608992,0.000801372,0.001396107,5.89E-05,0.000171393,0,0.002310342,0,0,0.000232859,0,0,
"Cherry, sweet, whole, fresh",0.788884973,"Cherry, sweet, whole, fresh, 78.8884973457162",Whole sweet cherry,Fruits,85,10.45,0.067145979,0.001560985,0.042387675,0.000667123,0.00197857,0.000137225,0.000756214,0,0.001855701,0,0,0,7.90E-05,0,
"Guava, whole, fresh",0.778051459,"Guava, whole, fresh, 77.8051459219688",Whole guava,Fruits,86,10.16,0.030236494,0.005053768,0.014304362,0.030458664,0.010691705,0.000728879,0.000704909,0,0.005783979,0,0,0.000520469,0,0,
"Orange, navel, flesh, fresh",0.872688138,"Orange, navel, flesh, fresh, 87.2688138379055",Navel orange,Fruits,87,10.27,0.038593827,0.00222452,0.015985914,0.000717657,0.001461286,0.000233108,0.000381808,0,0.003622659,0,0,0,0,0,
"Orange, valencia, flesh, fresh",0.856061636,"Orange, valencia, flesh, fresh, 85.6061635690259",Valencia orange,Fruits,88,10.31,0.037780942,0.002732526,0.013640175,0.000594178,0.003030622,0.000202665,0.000633473,0,0.007394546,0,0,0.000309755,0,0,
"Tangerine, pixie, flesh, fresh",0.779501794,"Tangerine, pixie, flesh, fresh, 77.9501794384632",Pixie tangerine,Fruits,89,10.42,0.075746205,0.002592397,0.022632377,0.000601078,0.001812716,0.000197346,0.000886182,0,0.003387514,0,0,0.000263495,0,0,
"Grapefruit, deep red, flesh, fresh",0.879175963,"Grapefruit, deep red, flesh, fresh, 87.9175963335946",Deep red grapefruit,Fruits,90,10.27,0.037101316,0.00176246,0.008909927,0.000773274,0.000984837,0.000248535,0.000447291,0,0.003730442,0,0,0.000136169,0,0,
"Kiwi Fruit, regular, flesh, fresh",0.856362509,"Kiwi Fruit, regular, flesh, fresh, 85.636250889128",Kiwi,Fruits,91,10.46,0.033955185,0.005861415,0.016763501,0.00291541,0.001188744,0.000263718,0.000295893,0,0.004568247,0,0,0.000476015,0,0,
"Kiwi Fruit, gold, flesh, fresh",0.763873449,"Kiwi Fruit, gold, flesh, fresh, 76.3873449099807",Golden kiwi,Fruits,92,10.1,0.092219933,0.001695153,0.040577639,0.000296811,0.000631875,0.000182762,0.000148524,0,0.00219881,0,0,0.000368594,0,0,
"Melon, cantaloupe, flesh, fresh",0.887848208,"Melon, cantaloupe, flesh, fresh, 88.7848208350958",Cantaloupe melon,Fruits,93,10.29,0.016598689,0.001202828,0.006892288,0.00026322,0.000586666,7.50E-05,9.58E-05,0,0.001882356,0,0,7.26E-05,0,0,
"Melon, Honeydew, flesh, fresh",0.921084662,"Melon, Honeydew, flesh, fresh, 92.1084662064648",Honeydew melon,Fruits,94,10.46,0.024740511,0.001015561,0.009555464,0.000477359,0.000298221,0.000121056,5.40E-05,0,0.001171261,0,0,2.80E-06,0,0,
"Melon, watermelon, mini seedless, flesh, fresh",0.91246706,"Melon, watermelon, mini seedless, flesh, fresh, 91.2467060089819",Seedless watermelon,Fruits,95,10.01,0.025021816,0.000888634,0.026956207,0.000512155,0.000275991,9.09E-05,2.33E-05,0,0.000865438,0,0,0,2.11E-05,0,
"Pineapple, gold, flesh, fresh",0.813455628,"Pineapple, gold, flesh, fresh, 81.3455628121398",Gold (golden) pineapple,Fruits,96,10.31,0.063076062,0.001778514,0.009932555,0.002052361,0.00172852,0.000545642,3.00E-05,0,0.000260602,0,0,3.92E-05,0,0,
"Papaya, tai nung, flesh, fresh",0.869775171,"Papaya, tai nung, flesh, fresh, 86.9775170629433",Tai nung papaya,Fruits,97,10.3,0.046719981,0.001548243,0.01260394,0.001329596,0.000327125,0.00030681,0.000235707,0,0.005622457,0,0,0.000338715,0,0,
"Papaya, mexican maradol, flesh, fresh",0.864707046,"Papaya, mexican maradol, flesh, fresh, 86.4707045863039",Mexican maradol papaya,Fruits,98,10.24,0.042340742,0.001185707,0.013651194,0.000953004,0.000372191,0.000209298,0.000181969,0,0.004951316,0,0,0,0,0,
"Grape, red seedless, whole, fresh",0.839885813,"Grape, red seedless, whole, fresh, 83.9885813047996",Red seedless grape,Fruits,99,10.35,0.056838295,0.00165494,0.041097309,0.000979579,0.000718592,0.000174204,0.000127771,0,0.001705857,0,0,7.01E-06,6.45E-05,0,
