"Cracker, Saltine Crackers, NA, box",0.027142626,"Cracker, Saltine Crackers, NA, box, 2.71426259450211",Saltine Crackers,Grain Products,672,10.459,0.566460799,0.004367157,0.001926258,0.004936278,0.006455882,0.000212083,3.34E-05,2.19E-05,3.11E-05,0,0,0.001887343,0,0.000138146,
"Cracker, Classic Crackers, NA, box",0.038933938,"Cracker, Classic Crackers, NA, box, 3.89339375149058",Classic Crackers,Grain Products,673,10.282,0.587372823,0.004450697,0.002540098,0.005674134,0.006890844,0.000346945,1.73E-05,1.60E-05,3.15E-05,0,0,0.001122525,0,7.49E-05,
"Cracker, Cheddar cheese minis, NA, box",0.001480863,"Cracker, Cheddar cheese minis, NA, box, 0.148086269744828",Mini Cheddar Cheese Biscuit ,Grain Products,674,10.507,0.325856735,0.020506588,0.004022035,0.002402437,0.00381634,0.000101849,3.99E-05,4.75E-05,4.08E-05,0,0,0.000907654,0,0.000171745,
"Cracker, Almond Nut-thins (almond and rice cracker w/ sea salt), NA, box",0.003766931,"Cracker, Almond Nut-thins (almond and rice cracker w/ sea salt), NA, box, 0.376693115332188",Thin Almond Nut Rice Crackers,Grain Products,675,10.277,0.661548569,0,0.005944523,0.001038075,0.017059495,0.000156409,0.000196258,8.99E-05,0.000226145,0,0,0.000496124,0,0.000304847,
"Cereal, Sprouted crunchy Golden Flax, NA, box",0.014381716,"Cereal, Sprouted crunchy Golden Flax, NA, box, 1.43817160666168",Sprouted Crunchy Golden Flax Cereal ,Grain Products,676,10.127,0.534854632,0.00319636,0.005981717,0.018493156,0.02029388,0.000274988,0.000161641,0.000126159,0.000116303,0,0,0.001062497,0,0.00030357,
"Cereal, Toasted whole wheat berry flakes & flaxseed cereal, NA, box",0.004337632,"Cereal, Toasted whole wheat berry flakes & flaxseed cereal, NA, box, 0.433763188745565",Toasted Whole Wheat Berry Flakes & Flaxseed Cereal,Grain Products,677,9.772,0.622746985,0.003550532,0.009768443,0.019542861,0.022696124,0.000137401,7.99E-05,5.28E-05,3.83E-05,0,0,0.001415832,0,0.000183202,
"Cereal, Organic Honey flakes & oat clusters, NA, box",0.02929053,"Cereal, Organic Honey flakes & oat clusters, NA, box, 2.92905303960911",Organic Honey Flakes & Oat Cluster Cereals,Grain Products,678,10.075,0.424971752,0.004238118,0.023133948,0.002425803,0.006785259,6.56E-05,3.78E-05,3.15E-05,2.40E-05,0,0,0,0,5.82E-05,
"Cereal, Organic Frosted flakes, NA, box",0.024767188,"Cereal, Organic Frosted flakes, NA, box, 2.47671884287696",Organic Frosted Flakes Cereals,Grain Products,679,9.915,0.670834369,0.001557447,0.042279268,0.000708994,0.005630994,0.000368638,1.16E-05,3.16E-05,2.91E-05,0,0,0.00043983,0,1.39E-05,
"Cereal, Organic Morning O's Honey nut, NA, box",0.028163138,"Cereal, Organic Morning O's Honey nut, NA, box, 2.81631375821423",Organic Morning O's Honey Nut Cereals,Grain Products,680,10.155,0.62013882,0.001277965,0.038605248,0.005616245,0.014543539,0.000203114,0.00013217,6.28E-05,6.91E-05,0,0,0.000856188,0,0.0004762,
"Cereal, Rainbow Morning O's, NA, box",0.037136567,"Cereal, Rainbow Morning O's, NA, box, 3.71365667292622",Rainbow Morning O's Cereals,Grain Products,681,10.255,0.544613852,0.001836181,0.028691405,0.004091207,0.009935788,0.000516095,9.82E-05,3.98E-05,6.92E-05,0,0,0.000535352,0,0.000122284,
"Cereal, Organic Morning O's, NA, box",0.037589956,"Cereal, Organic Morning O's, NA, box, 3.75899555963872",Organic Morning O's Cereals,Grain Products,682,10.128,0.665782757,0.009913786,0.005973679,0.010952226,0.036401235,0.000652514,0.000156873,8.99E-05,6.14E-05,0,0,0.001314652,0,0.000517777,
"Cereal, Pumpkin seed & Flax Granola, NA, box",0.030714762,"Cereal, Pumpkin seed & Flax Granola, NA, box, 3.07147619376052",Pumpkin Seed & Flaxseed Granola ,Grain Products,683,10.426,0.231128973,0.003423515,0.003975039,0.001783485,0.002933057,0.000186103,6.21E-05,1.53E-05,4.13E-05,0,0,0.000187072,0,9.98E-05,
"Cereal, Heritage flakes (kamut whea, oats, spelt, barley, millet, quinoa), NA, box",0.009414283,"Cereal, Heritage flakes (kamut whea, oats, spelt, barley, millet, quinoa), NA, box, 0.941428336169512",Heritage Flakes,Grain Products,684,10.408,0.520768742,0.005373928,0.003951446,0.012912285,0.01429118,0.000283308,9.41E-05,8.28E-05,0.000112927,0,0,0.001039124,0,0.000184249,
"Cereal, Autumn wheat organic whole wheat biscuit, NA, box",0.048052201,"Cereal, Autumn wheat organic whole wheat biscuit, NA, box, 4.80522013582281",Autumn Wheat Whole Wheat Biscuit,Grain Products,685,10.21,0.567449419,0.00802968,0.038759507,0.009500439,0.050180024,0.000273209,6.38E-05,6.57E-05,3.47E-05,0,0,0.001205166,0,0.000261786,
"Cereal, Original Go Rise (Plant protein & multigrain crips w/ honey), NA, box",0.037921008,"Cereal, Original Go Rise (Plant protein & multigrain crips w/ honey), NA, box, 3.79210079961237",Original Go Rise Cereals ,Grain Products,686,10.416,0.371933966,0.016098468,0.00341538,0.021810331,0.017322232,0.001185281,0.000522409,0.000200112,0.000700394,0,0,0.001756756,0,0.000429087,
"Meal, whole ground flaxseed meal, NA, bag",0.071846967,"Meal, whole ground flaxseed meal, NA, bag, 7.18469667799942",Whole Ground Flaxseed Meal ,"Beans, Peas, Legumes, Nuts, Seeds",687,10.24,0.027697015,0.025280104,0.004491333,0.020632842,0.023004273,0.00378408,0.004274145,7.39E-05,0.005486313,0,0,0.000486352,0,0.00053276,
"Soup, Vegi Soup mix, NA, bag",0.721549458,"Soup, Vegi Soup mix, NA, bag, 72.1549458150796",Vegi Soup Mix ,"Beans, Peas, Legumes, Nuts, Seeds",688,9.698,0.064640066,0.003505971,0.001370812,0.000444964,0.016183267,6.46E-05,0.000161223,1.89E-05,3.48E-05,0,0,0.000106925,0,0.000215521,
"Soup, 13 Beans Soup mix, NA, bag",0.782703395,"Soup, 13 Beans Soup mix, NA, bag, 78.2703395259449",13 Beans Soup Mix ,"Beans, Peas, Legumes, Nuts, Seeds",689,10.328,0.078203962,0.007806163,0.002206864,0.001822249,0.030622089,0.000269448,0.000212733,7.54E-05,0.000185354,0,0,0.001139503,0,0.000182095,
"Soup, Instant miso-cup Soup (Reduced sodium), NA, box",1.002629878,"Soup, Instant miso-cup Soup (Reduced sodium), NA, box, 100.262987828959",Instant Miso-Cup Soup (Low sodium),"Beans, Peas, Legumes, Nuts, Seeds",690,10.077,-6.67E-05,-1.18E-05,-1.71E-05,-5.61E-06,-4.37E-05,-2.61E-06,-2.48E-06,-7.07E-08,-1.19E-07,0,0,-1.97E-06,0,-1.95E-06,
"Soup, Instant miso-cup Soup (w/ seaweed), NA, box",0.951050343,"Soup, Instant miso-cup Soup (w/ seaweed), NA, box, 95.1050342533898",Instant Miso-Cup Soup (w/ Seaweed),"Beans, Peas, Legumes, Nuts, Seeds",691,9.819,0.001237545,0.000165792,4.93E-05,9.12E-05,0.000715399,6.03E-05,3.25E-05,1.12E-07,2.24E-06,0,0,3.15E-05,0,8.03E-06,
"Soup, Cream of cauliflower, NA, can",0.902153276,"Soup, Cream of cauliflower, NA, can, 90.2153275872461",Cream of Cauliflower Soup ,Vegetables,692,9.51,0.049889501,0.001567309,0.000149999,0.00011135,0.000567022,6.21E-05,5.79E-05,4.73E-06,0.00031174,0,0,9.80E-05,0,1.87E-05,
"Tofu, Extra firm Tofu, NA, box",0.836695588,"Tofu, Extra firm Tofu, NA, box, 83.6695587553504",Extra Firm Tofu (WIldwood),"Beans, Peas, Legumes, Nuts, Seeds",693,9.921,0.002866972,0.001639576,0,8.10E-05,0.000347348,0.000115783,0.000133093,5.47E-05,0.000300317,0,0,0.000840854,0,0.000171796,
"Tofu, Firm Tofu, NA, box",0.836361798,"Tofu, Firm Tofu, NA, box, 83.6361797866424",Firm Tofu (Wildwood),"Beans, Peas, Legumes, Nuts, Seeds",694,9.979,0.001680073,0.0016336,0,7.66E-05,0.000409096,8.61E-05,0.000117656,4.39E-05,0.000303222,0,0,0.000648498,0,0.000151856,
"Tofu, High Protein super firm Tofu, NA, box",0.759282772,"Tofu, High Protein super firm Tofu, NA, box, 75.9282772011119",High Protein Super Firm Tofu,"Beans, Peas, Legumes, Nuts, Seeds",695,10.408,0.003027019,0.002897995,0,9.92E-05,0.000619847,0.000178612,0.000225071,5.90E-05,0.000403683,0,0,0.001189865,0,0.000241921,
"Tofu, Firm Tofu, NA, box",0.806342572,"Tofu, Firm Tofu, NA, box, 80.6342571524348",Firm Tofu (Nasoya),"Beans, Peas, Legumes, Nuts, Seeds",696,10.383,0.00286613,0.001632919,0.002189104,7.18E-05,0.000745968,8.54E-05,0.000162672,3.99E-05,0.000397385,5.81E-05,4.47E-05,0.000448898,0,0.000213991,
"Tofu, Medium Firm Tofu, NA, box",0.847749631,"Tofu, Medium Firm Tofu, NA, box, 84.7749631303115",Medium Firm Tofu (House Foods),"Beans, Peas, Legumes, Nuts, Seeds",697,9.845,0.005611949,0.003373868,0.00081865,2.21E-05,0.000391131,4.78E-05,0.000100181,3.40E-05,0.000183462,0,0,0.000683756,0,0.00017387,
"Tofu, Firm Tofu, NA, box",0.84129597,"Tofu, Firm Tofu, NA, box, 84.1295970175878",Firm Tofu (House Foods),"Beans, Peas, Legumes, Nuts, Seeds",698,10.227,0.004853169,0.002030935,0.000592918,2.14E-05,0.000378192,0.000126646,8.84E-05,3.57E-05,0.000217425,0,0,0.000812406,0,0.000183144,
"Tofu, Extra firm Tofu, NA, box",0.810605682,"Tofu, Extra firm Tofu, NA, box, 81.0605681773985",Extra Firm Tofu (Nasoya),"Beans, Peas, Legumes, Nuts, Seeds",699,10.421,0.003976712,0.001609852,0.000993373,7.05E-05,0.000414774,0.000129735,0.000193372,6.70E-05,0.000337501,0,0,0.000796782,0,0.000147728,
"Tofu, Extra firm Tofu, NA, box",0.804330354,"Tofu, Extra firm Tofu, NA, box, 80.4330353545973",Extra Firm Tofu (House Foods),"Beans, Peas, Legumes, Nuts, Seeds",700,9.587,0.002643106,0.001853187,0.00113821,3.91E-05,0.000457671,0.000122098,0.000145383,5.64E-05,0.000223846,0,0,0.000460215,0,0.000213084,
"Tofu, Extra firm silken tofu, NA, box",0.875026383,"Tofu, Extra firm silken tofu, NA, box, ",Extra Firm Silken Tofu ,"Beans, Peas, Legumes, Nuts, Seeds",701,9.675,0.00267406,0.001739758,0.000741468,6.45E-06,0.000288689,5.89E-05,0.000104353,5.37E-05,8.84E-05,0,0,0.000453279,0,0.00016584,
"Tofu, Soft silken tofu, NA, box",0.894978861,"Tofu, Soft silken tofu, NA, box, ",Soft Silken Tofu ,"Beans, Peas, Legumes, Nuts, Seeds",702,10.376,0.006219562,0.003299764,0.002252703,7.34E-06,0.000210567,2.62E-05,5.34E-05,4.99E-05,9.63E-05,0,0,0.000485198,0,0.000102711,
"Tofu, Firm silken tofu, NA, box",0.869716768,"Tofu, Firm silken tofu, NA, box, ",Firm Silken Tofu ,"Beans, Peas, Legumes, Nuts, Seeds",703,9.844,0.003414202,0.003068561,0.001324459,0.000218615,0.000230992,7.31E-05,8.76E-05,6.10E-05,0.000101881,0,0,0.000311377,0,0.000141618,
"Waffle, Original waffle , NA, box",0.410680913,"Waffle, Original waffle , NA, box, ",Original Waffle ,Grain Products,704,10.347,0.218042169,0.002479265,0.002147479,0.002645453,0.003293115,0.000277569,3.29E-05,1.25E-05,3.65E-05,0,0,0.000416059,0,8.84E-05,
"Waffle, 8 whole grain multigrain waffle, NA, box",0.473807827,"Waffle, 8 whole grain multigrain waffle, NA, box, ","8 Whole Grain, Multigrain Waffle ",Grain Products,705,9.881,0.22659624,0.003662824,0.001517012,0.007117275,0.005961757,0.000434109,5.53E-05,2.68E-05,4.83E-05,0,0,0.000404642,0,0.000109448,
"Waffle, Blueberry waffle, NA, box",0.39870565,"Waffle, Blueberry waffle, NA, box, ",Blueberry Waffle ,Grain Products,706,10.317,0.194079777,0.001467158,0.003528395,0.007623811,0.005399022,0.000102821,3.25E-05,4.40E-05,1.96E-05,0,0,0.000564615,0,7.70E-05,
"Waffle, Gluten-free chia plus waffle , NA, box",0.318146329,"Waffle, Gluten-free chia plus waffle , NA, box, ",Gluten-Free Chia Plus Waffle ,Grain Products,707,9.734,0.48559982,0.005004806,0.002931971,0.000512754,0.001726453,0.000452069,5.06E-05,4.32E-05,0.000125461,0,0,0.000244785,0,5.95E-05,
"Waffle, Flax plus waffle, NA, box",This was not in data,"Waffle, Flax plus waffle, NA, box, ",Flax Plus Waffle ,Grain Products,708,10.46,#VALUE!,#VALUE!,#VALUE!,#VALUE!,#VALUE!,#VALUE!,#VALUE!,#VALUE!,#VALUE!,#VALUE!,#VALUE!,#VALUE!,#VALUE!,#VALUE!,
"Pancake, Original Pancake, NA, box",0.515447792,"Pancake, Original Pancake, NA, box, ",Original Pancake ,Grain Products,709,10.165,0.243505413,0.002593808,0.001876671,0.002059831,0.00291119,0.000120653,2.16E-05,2.35E-05,2.10E-05,0,0,0.00055142,0,9.21E-05,
"Broccoli, broccoli cuts, whole, frozen",0.896794011,"Broccoli, broccoli cuts, whole, frozen, ",Frozen Broccoli Cuts (Birds Eye),Vegetables,710,9.833,0.01017673,0.002986369,0.00183397,0.000431814,0.004177366,0.000185461,0.000351313,4.15E-06,0.003121568,0,0,0.000429027,0,0.000304974,
"Spinach, Cut leaf, leaf, frozen",0.907313171,"Spinach, Cut leaf, leaf, frozen, ",Frozen Spinach Leaf Cut (Best Yet),Vegetables,711,10.086,0.003680223,0.001934096,0.00112874,0.000364908,0.002359251,9.93E-05,0.000355176,4.78E-05,0.001810174,0,0,9.76E-05,0,0.000151543,
"Peas, sweet green peas, whole, frozen",0.782593036,"Peas, sweet green peas, whole, frozen, ",Frozen Whole Sweet Green Peas (Flav R Pac),"Beans, Peas, Legumes, Nuts, Seeds",712,9.59,0.068519066,0.002411695,0.009407634,0.000495253,0.00775295,0.000180665,0.000251322,3.30E-05,0.001507935,0,0,0,0,0.000400681,
"Green beans, NA, whole, frozen",0.873404906,"Green beans, NA, whole, frozen, ",Frozen Whole Green Beans (Birds Eye),Vegetables,713,9.783,0.039339932,0.005784763,0.012241999,0.00074286,0.002235543,0.000192931,0.000316361,1.97E-05,0.00617936,5.79E-05,4.46E-05,0.001347858,0,0.000195969,
"Broccoli, broccoli cuts, whole, frozen",0.891161513,"Broccoli, broccoli cuts, whole, frozen, ",Frozen Broccoli Cuts (Flav R Pac),Vegetables,714,9.806,0.013263058,0.003168288,0.002013294,0.000634855,0.004891093,0.000216153,0.000474862,5.75E-05,0.003023969,0,0,0.000542778,0,0.000287987,
"Cauliflower, florets, whole, frozen",0.931014711,"Cauliflower, florets, whole, frozen, ",Frozen Cauliflower Florets (Flav R Pac),Vegetables,715,10.285,0.009115923,0.001847288,0.000629767,0.000308985,0.002488575,0.00013121,0.000246277,0,0.002132749,0,0,0.000298499,0,0.000112515,
"Collard greens, chopped, whole, frozen",0.90496945,"Collard greens, chopped, whole, frozen, ",Frozen Chopped Collard Greens ,Vegetables,716,10.377,0.006459417,0.003239877,0.000499291,0.000964465,0.002787531,0.000264375,0.000474202,1.64E-05,0.003844271,2.91E-05,2.53E-05,0.000221706,0,0.000183219,
"Corn, NA, whole kernel, frozen",0.703825796,"Corn, NA, whole kernel, frozen, ",Frozen Corn Kernels (Flav R Pac),Vegetables,717,10.293,0,0,0,0,0,0,0,0,0,0,0,0,0,0,
"Green beans, NA, whole, frozen",0.876182927,"Green beans, NA, whole, frozen, ",Frozen Whole Green beans (Birds Eye),Vegetables,718,9.681,0.020686366,0.004007463,0.000552967,0.000614752,0.002237251,0.000216556,0.000363403,2.02E-05,0.005459714,0,0,0.001082285,0,0.0001544,
"Carrots, Crinkle cut, whole, frozen",0.891656225,"Carrots, Crinkle cut, whole, frozen, ",Frozen Whole Crinkle Cut Carrots ,Vegetables,719,9.792,0.029942536,0.005380894,0.001252021,0.000171942,0.002945867,0.000296537,0.000480613,8.80E-06,0.004045015,0,0,0.000323189,0,5.96E-05,
"Spinach, chopped baby spinach, whole, frozen",0.92090003,"Spinach, chopped baby spinach, whole, frozen, ",Frozen Chopped Baby Spinach (Birds Eye),Vegetables,720,10.275,0.004483386,0.002393802,0.000271392,0.000522139,0.002376084,0.000205264,0.000558288,3.67E-05,0.002478518,0,0,0.000165635,0,0.000127035,
"Spinach, chopped spinach, whole, frozen",0.908418281,"Spinach, chopped spinach, whole, frozen, ",Frozen Chopped Spinach (Green Giant),Vegetables,721,10.454,0.002376912,0.00127958,0.000428694,0.000300571,0.001468238,0.000102114,0.000303044,4.14E-05,0.00220831,0,0,8.87E-05,0,0.000135816,
"Spinach, cut spinach, whole, frozen",0.924617155,"Spinach, cut spinach, whole, frozen, ",Frozen Spinach Cut (Cascadian),Vegetables,722,10.619,0.001984529,0.001294399,0.000289621,0.000233611,0.002367172,6.95E-05,0.000390935,3.62E-05,0.001883591,0,0,0.000165767,0,0.000133578,
"Brussel Sprouts, NA, whole, frozen ",no dry mass yet,"Brussel Sprouts, NA, whole, frozen , ",Frozen Whole Brussel Sprouts (Birds Eye),Vegetables,723,9.97,#VALUE!,#VALUE!,#VALUE!,#VALUE!,#VALUE!,#VALUE!,#VALUE!,#VALUE!,#VALUE!,#VALUE!,#VALUE!,#VALUE!,#VALUE!,#VALUE!,
"Peas, petite, whole, frozen ",0.820595085,"Peas, petite, whole, frozen , ",Frozen Petite Peas (Birds Eye),"Beans, Peas, Legumes, Nuts, Seeds",724,10.332,0.04260185,0.002260681,0.002711346,0.000493902,0.004997324,9.69E-05,0.00032849,4.29E-06,0.002016691,0,0,3.10E-06,0,0.000276822,
"Peas, sweet peas, whole, frozen",0.775221751,"Peas, sweet peas, whole, frozen, ",Frozen Sweet Peas (Cascadian),"Beans, Peas, Legumes, Nuts, Seeds",725,10.028,0.118993334,0.003787514,0.04229967,0.002322858,0.010713156,0.00015667,0.000282771,1.29E-05,0.001685163,0,0,3.89E-05,0,0.000439217,
"Broccoli, florets, whole, frozen",0.908650189,"Broccoli, florets, whole, frozen, ",Frozen Broccoli Florets (Stahlbush),Vegetables,726,10.116,0.0095139,0.002408255,0.001358737,0.000424685,0.003935076,0.000228923,0.000359553,7.13E-06,0.002845273,3.40E-05,0,0.000331965,0,0.000282088,
"Corn, golden corn, whole kernel, frozen",0.759961211,"Corn, golden corn, whole kernel, frozen, ",Frozen Golden Corn Kernels (Siganture Select),Vegetables,727,10.393,0.176299609,0.00185718,0.016681256,0.003497125,0.006515373,4.30E-05,7.27E-05,2.57E-06,0.000233798,0,0,0.000674989,0,0.000189391,
"Spinach, cut leaf, leaf, frozen",0.928043323,"Spinach, cut leaf, leaf, frozen, ",Frozen Spinach Leaf Cut (Signature Select),Vegetables,728,9.914,0.002140351,0.001289823,0.001007753,0.000410873,0.001235208,4.97E-05,0.000304808,2.87E-05,0.002036014,0,0,0.000145568,0,9.38E-05,
"Spinach, chopped spinach, whole, frozen",0.939210037,"Spinach, chopped spinach, whole, frozen, ",Frozen Chopped Spinach (Signature Select),Vegetables,729,9.718,0.002936094,0.001245708,0.000735315,0.000381457,0.001343276,0.000100911,0.000329421,3.37E-05,0.00178528,0,2.46E-05,2.69E-05,0,0.000130759,
"Broccoli, petite broccoli florets, whole, frozen",0.900539718,"Broccoli, petite broccoli florets, whole, frozen, ",Frozen Petite Broccoli Florets (Signature Select),Vegetables,730,10.134,0.007718018,0.002941836,0.001124001,0.00051421,0.004642707,0.000228858,0.000437625,1.66E-05,0.003289748,0,0,0.000136161,0,0.00025054,
"Brussel Sprouts, petite brussel sprouts, whole, frozen ",0.856914747,"Brussel Sprouts, petite brussel sprouts, whole, frozen , ",Frozen Petite Brussel Sprouts (Woodstock),Vegetables,731,10.382,0.01986567,0.003934129,0.000754489,0.000465027,0.006311777,0.000296616,0.000611403,0,0.003589437,0,0,0.00044986,0,0.00023466,
"Corn, sweet corn, whole kernel, frozen",0.710332951,"Corn, sweet corn, whole kernel, frozen, ",Frozen Sweet Corn Kernels (Cascadian),Vegetables,732,10.189,0,0,0,0,0,0,0,0,0,0,0,0,0,0,
"Spinach, cut spinach, whole, frozen",0.802774412,"Spinach, cut spinach, whole, frozen, ",Frozen Spinach Cut (Woodstock),Vegetables,733,10.206,0.009681015,0.00375912,0.002130431,0.000911774,0.004085134,0.000258168,0.000694234,0.000108474,0.0058718,0,0,0.000616724,0,0.000249096,
"Cauliflower, NA, whole, frozen",0.928924713,"Cauliflower, NA, whole, frozen, ",Frozen Whole Cauliflower (Stahlbush),Vegetables,734,9.737,0.012257431,0.00232203,0.000312234,0.000491983,0.002764971,0.000201925,0.000311239,3.81E-06,0.002125649,0,0,0.000342156,0,0.000120757,
"Asparagus, baby asparagus, whole, frozen",0.921495598,"Asparagus, baby asparagus, whole, frozen, ",Frozen Whole Baby Asparagus ,Vegetables,735,10.446,0.005841042,0.000850203,0.00047032,0.000659672,0.001441733,0.000199951,0.000304833,1.22E-07,0.001250497,0,0,0.000585329,0,0.000278612,
"Peas, Green peas, whole, frozen",0.561448131,"Peas, Green peas, whole, frozen, ",Frozen Whole Green Peas (Signature Select),"Beans, Peas, Legumes, Nuts, Seeds",736,10.073,0.116157041,0.005520052,0.001697196,0.00149897,0.016282554,0.000581958,0.000713524,3.54E-05,0.003108456,0,0,0.000135951,0,0.000741591,
"Broccoli, florets, whole, frozen",0.91333726,"Broccoli, florets, whole, frozen, ",Frozen Broccoli Florets (Birds Eye),Vegetables,737,10.443,0.007156522,0.002312942,0.000357744,0.000643038,0.003427338,0.000236416,0.000374556,4.42E-06,0.002857357,0,0,0.000367883,0,0.000252275,
"Beans, Edamame. whole, frozen",0.695732125,"Beans, Edamame. whole, frozen, ",Frozen Whole Edamame,Vegetables,738,11.004,0.023536946,0.005647516,0.000821828,0.000817568,0.004238452,0.00051117,0.000462791,0.000117143,0.001658564,0,0,0.00175806,0,0.000448795,
"Peas, Green peas, whole, frozen",0.767897017,"Peas, Green peas, whole, frozen, ",Frozen Whole Green Peas (Stahlbush),"Beans, Peas, Legumes, Nuts, Seeds",739,11.316,0.065119509,0.00288945,0.002943066,0.000599754,0.006131232,0.000340495,0.000252064,9.45E-06,0.001411186,0,0,0,0,0.000402931,
"Brussel Sprouts, petite brussel sprouts, whole, frozen ",0.876725504,"Brussel Sprouts, petite brussel sprouts, whole, frozen , ",Frozen Petite Brussel Sprouts (Signature Select),Vegetables,740,10.144,0.019034199,0.003334945,0.001710187,0.000695022,0.005987319,0.000165558,0.000508754,4.56E-06,0.003521952,0,0,0.000469429,0,0.000213388,
"Cauliflower, florets, whole, frozen",0.93144003,"Cauliflower, florets, whole, frozen, ",Frozen Cauliflower Florets (Signature Select),Vegetables,741,10.394,0.015540214,0.002611381,0.005678685,0.000556844,0.003204219,0.000261419,0.000278971,6.33E-06,0.002039111,0,0,0.000296522,0,0.000110313,
"Green beans, french sliced, whole, frozen",0.918957428,"Green beans, french sliced, whole, frozen, ",Frozen French-sliced Green Beans (SIgnature Select),Vegetables,742,10.192,0.015015973,0.004800881,0.00163317,0.000409022,0.001708864,0.000158114,0.000274491,1.42E-05,0.003621955,0,0,0.000243047,0,0.000132991,
"Broccoli, florets, whole, frozen",0.90379055,"Broccoli, florets, whole, frozen, ",Frozen Broccoli Florets (Cascadian),Vegetables,743,10.326,0.009221483,0.002569851,0.001165866,0.000640563,0.004173085,0.00020483,0.000398115,7.31E-06,0.002929482,0,0,0.000264287,0,0.00023148,
"Brussel Sprouts, petite brussel sprouts, whole, frozen ",0.875961205,"Brussel Sprouts, petite brussel sprouts, whole, frozen , ",Frozen Petite Brussel Sprouts (Signature Select),Vegetables,744,10.306,0.015618221,0.003810844,0.000592781,0.00058968,0.006543295,0.000334781,0.000565617,2.98E-06,0.003745724,0,0,0.000513521,0,0.000198338,
"Green beans, cut green beans, whole, frozen",0.910718975,"Green beans, cut green beans, whole, frozen, ",Frozen Cut Green Beans (Cascadian),Vegetables,745,10.07,0.014320409,0.004153621,0.000279628,0.000516848,0.001559204,0.000237666,0.000268914,2.10E-05,0.004065322,0,1.08E-05,0.000472386,0,9.37E-05,
"Cilantro, whole, fresh ",0.875563081,"Cilantro, whole, fresh , ",Cilantro,Vegetables,746,10.162,0.004644359,0.001596775,0.007029939,0.00046527,0.000764789,0,0.000471491,0.000154053,0.003574824,0,0,0.000349917,0,9.56E-05,
"Cabbage, whole, fresh",no dry mass yet,"Cabbage, whole, fresh, ",Cabbage,Vegetables,747,10.391,#VALUE!,#VALUE!,#VALUE!,#VALUE!,#VALUE!,#VALUE!,#VALUE!,#VALUE!,#VALUE!,#VALUE!,#VALUE!,#VALUE!,#VALUE!,#VALUE!,
"Garlic, whole, fresh",0.568865755,"Garlic, whole, fresh, ",Garlic,Vegetables,748,9.813,0.008796432,0.004037572,0.032194088,0.000589361,0.001061021,0.000582462,0.000325075,0,0.002627332,0,0,0,0,0.000113819,
"Onion, whole, fresh",0.917827275,"Onion, whole, fresh, ",Onion,Vegetables,749,10.495,0.016568651,0.002027119,0.004545959,0.000177904,0.00021899,0.000195982,8.46E-05,0,0.002136737,0,0,2.28E-05,0,2.02E-05,
"Jalapeno, whole, fresh",0.929387166,"Jalapeno, whole, fresh, ",Jalapeno,Vegetables,750,10.061,0.011034315,0.001431746,0.003633383,0.000279697,0.000556217,0.000152806,0.000491112,0,0.002652359,0,0,0.000135082,0,6.14E-05,
"Parsley, whole, fresh ",0.846590758,"Parsley, whole, fresh , ",Parsley,Vegetables,751,9.976,0.010088345,0.001618621,0.007584553,0.000523586,0.00175224,0,0.000343176,4.28E-05,0.003862078,0,0,0.000239932,0,0.000158932,
"Basil, leaves, fresh",0.869303774,"Basil, leaves, fresh, ",Basil,Vegetables,752,9.968,0.012390917,0.002405856,0.005604516,0.000483445,0.00059689,0,0.000310404,3.39E-05,0.006195916,0,0,0.000115535,0,0.000102727,
"Baby Spring Mix (Romaine lettuce, red romaine lettuce, spinach, oakleaf lettuce, green chard, lolla rosa, aragula, tatsoi, greenleaf lettuce, redleaf lettuce), whole, fresh ",0.931547557,"Baby Spring Mix (Romaine lettuce, red romaine lettuce, spinach, oakleaf lettuce, green chard, lolla rosa, aragula, tatsoi, greenleaf lettuce, redleaf lettuce), whole, fresh , ",Baby Spring Mix,Vegetables,753,10.293,0.00272208,0.001191278,0.002335187,0.000368548,0.00041845,3.89E-06,0.000214735,3.24E-05,0.002717288,0,0,0.00021364,0,8.51E-05,
"Broccoli, whole, fresh",0.864638352,"Broccoli, whole, fresh, ",Broccoli,Vegetables,754,10.15,0.010615873,0.003436426,0.009008994,0.000901238,0.00352035,7.17E-05,0.000423005,4.33E-05,0.003738012,0,0,0.000715792,0,0.000269505,
"Pickle, Kosher Dill, whole, jar (?)",0.94984085,"Pickle, Kosher Dill, whole, jar (?), ",Pickles ,Vegetables,755,10.322,0.004071819,0.001147039,0.004422332,0.000274722,0.000250645,1.31E-05,5.54E-05,0,0.00138033,0,0,6.98E-05,0,1.46E-05,
"Olive, black pitted california medium, whole, can",no dry mass yet,"Olive, black pitted california medium, whole, can, ",Olives,Vegetables,756,10.114,#VALUE!,#VALUE!,#VALUE!,#VALUE!,#VALUE!,#VALUE!,#VALUE!,#VALUE!,#VALUE!,#VALUE!,#VALUE!,#VALUE!,#VALUE!,#VALUE!,
"Beans, refried, can",0.783860809,"Beans, refried, can, ",Refried Beans,"Beans, Peas, Legumes, Nuts, Seeds",757,9.828,0.072737754,0.004075953,0.002292588,0.002288049,0.008517829,0.000609296,0.000203603,8.82E-05,0.000456918,5.58E-05,0,0.001105552,0,0.000144813,
"Tomato, sauce, can",0.903217696,"Tomato, sauce, can, ",Tomato sauce,Fruits,758,9.603,0.015788484,0.000685606,0.003133714,0.000232084,0.000330802,0.000330608,0.00011701,2.48E-07,0.00275878,0,0,0.000179918,0,6.39E-05,
"Syrup, maple, bottle",0.270519161,"Syrup, maple, bottle, ",Maple syrup,"Sugars, Sweets, and Beverages",759,9.653,0.318458508,0.000269178,0.037154648,9.78E-05,0.000667475,0.002070996,3.03E-05,4.03E-05,1.23E-05,0,0,0.000707596,0,3.77E-05,
"Honey, wildflower, bottle",0.250791123,"Honey, wildflower, bottle, ",Honey,"Sugars, Sweets, and Beverages",760,10.306,0.286604611,0.000536434,0.060882961,2.19E-05,0.001287141,0.001099089,1.48E-05,1.18E-05,4.61E-05,0,0,0.000494478,0,2.50E-05,
"Soy sauce, bottle",0.683634386,"Soy sauce, bottle, ",Soy sauce,"Beans, Peas, Legumes, Nuts, Seeds",761,10.064,0.002580911,0.005165934,0.000260685,0.001624854,0.001478377,0.000534974,0.000275554,3.95E-05,0.000521687,3.80E-05,0,0.0014537,0,0.000115157,
