"Bread, whole grain, inside only, fresh",0.26541539,"Bread, whole grain, inside only, fresh, 26.5415389622718",Inside only Whole grain bread ,Grain Products,196,10.2,0.325511336,0.004298055,0.00300592,0.010633112,0.019988782,0.000775721,0.000117534,8.30E-05,0.000212295,0,0,0.001473577,0,0.00040696,
"Bread, whole grain, crust only, fresh",0.14991233,"Bread, whole grain, crust only, fresh, 14.9912329608352",Crust only whole grain bread,Grain Products,197,10.07,0.367160516,0.002367494,0.003229483,0.014717568,0.028254364,0.000635015,0.000154716,0.000159816,0.000300931,0,0,0.002239131,0,0.000459047,
"Bread, oatnut, whole, fresh",0.207129168,"Bread, oatnut, whole, fresh, 20.7129167578772",Whole oatnut bread,Grain Products,198,10.29,0.37632504,0.003797058,0.004910249,0.003940568,0.009120393,0.000985538,6.83E-05,3.82E-05,0.00022359,0,0,0.002577623,0,0.000441629,
"Bread, potato, whole, fresh",0.263813246,"Bread, potato, whole, fresh, 26.3813245835859",Whole potato bread,Grain Products,199,10.04,0.482010179,0.004261785,0.004719693,0.004346447,0.006181024,0.000421835,3.89E-05,3.22E-05,0.000114845,0,0,0.001564397,0,0.000329812,
"Bread, English muffin, whole, fresh",0.361414899,"Bread, English muffin, whole, fresh, 36.1414899471017",Whole Extra Crisp English muffin (Oroweat),Grain Products,200,10.26,0.443303222,0.00081675,0.003982217,0.00352946,0.006427359,0.000395923,1.97E-05,2.11E-05,0,0,0,0.001813582,0,0.000316738,
"Bread, English muffin, whole, fresh",0.285359725,"Bread, English muffin, whole, fresh, 28.5359724779961",Whole Whole Grains English muffin (Oroweat),Grain Products,201,10.31,0.329418437,0.00108268,0.004962462,0.005902929,0.006329569,0.000940467,3.35E-05,4.58E-05,0,0,0,0.001394263,0,0.000371613,
"Bread, English muffin, whole, fresh",0.319538892,"Bread, English muffin, whole, fresh, 31.9538892033451",Whole Double Fiber English muffin (Oroweat),Grain Products,202,10.2,0.343032693,0.001100986,0.005462061,0.009234538,0.00904537,0.000839009,3.63E-05,6.87E-05,0,0,0,0.00126906,0,0.000346355,
"Bread, English muffin, whole, fresh",0.278952215,"Bread, English muffin, whole, fresh, 27.8952215183469",Whole Original English muffin (Thomas),Grain Products,203,10.32,0.458095358,0.001483916,0.005267975,0.00409483,0.005497989,0.000616496,1.21E-05,2.65E-05,0,0,0,0.001222897,0,0.000212709,
"Bread, English muffin, whole, fresh",0.317557498,"Bread, English muffin, whole, fresh, 31.7557498442871",Whole Light Multi Grain English muffin,Grain Products,204,10.29,0.367590829,0.002297784,0.002401515,0.004846024,0.004595568,0.00018153,1.65E-05,0,0,0,0,0.001246822,0,0.000280484,
"Tortillas, flour, whole, fresh",0.312181845,"Tortillas, flour, whole, fresh, 31.2181844625901", Flour tortilla,Grain Products,205,10.11,0.364857955,0.002228531,0.002575191,0.003889612,0.005197154,0.00034047,1.20E-05,0,0,0,0,0.001641822,0,0.000231795,
"Tortillas, yellow corn, whole, fresh",0.416392783,"Tortillas, yellow corn, whole, fresh, 41.6392782882822",Yellow corn tortilla,Grain Products,206,10.3,0.280953767,0.004362464,0.001563484,0.004451172,0.006588342,0.000127226,4.03E-05,0,0.000106217,0,0,0.001794592,0,0.000242781,
"Tortillas, white corn, whole, fresh",0.426621765,"Tortillas, white corn, whole, fresh, 42.6621765331443",White corn tortilla,Grain Products,207,10.41,0.305521725,0.004475217,0.001754537,0.003783723,0.006453372,0.000307331,4.33E-05,0,0.000105502,0,0,0.001604886,0,0.000217884,
"Tortillas, whole wheat, whole, fresh",0.308290662,"Tortillas, whole wheat, whole, fresh, 30.829066176758",Whole wheat tortilla,Grain Products,208,10.24,0.306178221,0,0.001958921,0.009694306,0.011376543,0.000277375,4.00E-05,0,6.37E-05,0,0,0.000582419,0,0.000306427,
"Jam, strawberry, NA, jar",0.727561908,"Jam, strawberry, NA, jar, 72.7561907707261",Sugar free Strawberry jam (Smuckers),Fruits,209,10.16,0.194090073,0.003386678,0,0.00017545,0.00066938,0,0.000180082,0,0.003109608,0,0,0.002438048,0,3.68E-05,
"Jam, strawberry, NA, jar",0.296127056,"Jam, strawberry, NA, jar, 29.6127055716691",Strawberry Jam (Smuckers),Fruits,210,10.02,0.514400202,0.000878433,0.067490857,0.000486376,0.000736955,0,9.08E-05,0.000211866,0.001412673,0.000610258,0.000245652,0,0,0.000138663,
"Jam, Raspberry, NA, jar",0.306228119,"Jam, Raspberry, NA, jar, 30.6228119208026",Raspberry jam (Bonne Maman),Fruits,211,10.71,0.271528439,0.000597338,0.108899291,0.001073265,0.000840158,0,0.000179687,0,0.002605807,0,0,0,0,0.000129735,
"Jam, Orange, NA, jar",0.278808848,"Jam, Orange, NA, jar, 27.8808848323165",Orange jam (Bonne Maman),Fruits,212,10.41,0.327226782,0.001267133,0.132799417,0.000635369,0.000838745,0,0.000457956,0,0.002330169,0.000583444,0.000235108,0,0,0.0001089,
"Jam, fig, NA, jar",0.311550747,"Jam, fig, NA, jar, 31.1550746777431",Fig jam (Bonne Maman),Fruits,213,11,0.343557519,0.000384843,0.136029311,0.000232007,0.000698088,0,0.000215485,0,0.002811627,0.00038622,0.00015559,0,0,0.000132871,
"Jam, strawberry, NA, jar",0.288814806,"Jam, strawberry, NA, jar, 28.8814805512108",Strawberry jam (Bonne Maman),Fruits,214,11.09,0.302834746,0.000459426,0.122883556,0.000506364,0.000459426,0,0.000121613,0,0.000700517,0.00027025,0.000108811,0,0,9.67E-05,
"Jam, plum, NA, jar",0.276776372,"Jam, plum, NA, jar, 27.6776371854201",Plum jam (Bonne Maman),Fruits,215,11.02,0.307626063,0.000595213,0.103771019,0.000322558,0.000520721,0,0.000125841,0,0.000763724,0.000500471,0.000201779,0,0,6.33E-05,
"Jam, mango-peach, NA, jar",0.274839566,"Jam, mango-peach, NA, jar, 27.4839566275725",Mango Peach jam (Bonne Maman),Fruits,216,11.01,0.288818348,0.000936182,0.116981431,0.000569976,0.001336471,0,0.000163161,0,0.002657713,0,0,0,0,8.77E-05,
"Spread, peanut, NA, jar",0.00497978,"Spread, peanut, NA, jar, 0.497977955752937",Creamy peanut butter (Skippy),"Beans, Peas, Legumes, Nuts, Seeds",217,10,0.058430572,0.00222586,0.002662674,0.002497501,0.018254641,0.000824872,0.000470645,7.59E-05,0.001267656,0,0,0.000583082,0,0.000384078,
"Spread, peanut, NA, jar",0.000565664,"Spread, peanut, NA, jar, 0.0565664184029292",Peanut butter (Laura Scudder's),"Beans, Peas, Legumes, Nuts, Seeds",218,10.6,0.028682766,0.003225175,0.000638639,0.002029851,0.015183406,0.001076391,0.000411767,3.49E-05,0.001317254,0,0,0.000510711,0,0.000364794,
"Spread, hazelnut, NA, jar",0.00203293,"Spread, hazelnut, NA, jar, 0.203293010752692",Nutella spread,"Beans, Peas, Legumes, Nuts, Seeds",219,10.07,0.318250701,0.029639622,0.152532281,0.000886195,0.004139567,0,0.000439106,0,0.001980965,0,0,0.001983959,0.000146701,0,
"Spread, sesame seed, NA, jar",0.00259021,"Spread, sesame seed, NA, jar, 0.259020994828998",Seasme seed butter (Organics),"Beans, Peas, Legumes, Nuts, Seeds",220,10.58,0.016050318,0.005239394,0,0.002284068,0.005758047,0,0.000319171,0,0.001127073,0,0,0.013428128,0.000212448,0,
"Spread, cashew, NA, jar",0.008467265,"Spread, cashew, NA, jar, 0.846726494890276",Cashew butter (Open Nature),"Beans, Peas, Legumes, Nuts, Seeds",221,9.77,0.147061161,0.012149251,0,0.002357865,0.004924943,0.000366867,0.000404545,0,0.003388067,0,0,0,0.000374799,0,
"Spread, peanut, NA, jar",0.00419415,"Spread, peanut, NA, jar, 0.419414969888166",Peanut butter (JIF),"Beans, Peas, Legumes, Nuts, Seeds",222,10.48,0.04192741,0.002676726,0,0.004221221,0.009771843,0.000478983,0.000550681,0,0.003341924,0,0,0,0.000175262,0,
"Spread, peanut, NA, sachet",4.57E-05,"Spread, peanut, NA, sachet, 0.00456767003150628",Peanut Butter (Justin's),"Beans, Peas, Legumes, Nuts, Seeds",223,10.41,0.102273328,0.011151491,0,0.009338573,0.025762823,0.001297941,0.001424935,0,0.005097767,0,0,0.001511931,0.000340984,0,
"Spread, almond, NA, sachet",0.002505891,"Spread, almond, NA, sachet, 0.250589133393082",Almond Butter (Justin's),"Beans, Peas, Legumes, Nuts, Seeds",224,10.18,0.025916892,0.012177408,0,0.014894582,0.044356568,0.002024913,0.002348101,0,0.005345571,0,0,0.000873805,0,0,
"Spread, hazelnut & almond, NA, sachet",0.100159389,"Spread, hazelnut & almond, NA, sachet, 10.0159388725985",Hazelnut and Almond Butter (Justin's),"Beans, Peas, Legumes, Nuts, Seeds",225,10.94,0.07519698,0.00909199,0,0.006869383,0.019711908,0.001276874,0.001373157,0,0.005086799,0,0,0,0.000123278,0,
"Spread, almond, NA, sachet",0.006631674,"Spread, almond, NA, sachet, 0.663167442344566",Vanilla almond Butter (Justin's),"Beans, Peas, Legumes, Nuts, Seeds",226,10.52,0.100934169,0.016319055,0.000865224,0.009800572,0.037917862,0.001393696,0.002037398,0,0.003735065,0,0,0,0.000195694,0,
"Spread, almond, NA, sachet",0.00311744,"Spread, almond, NA, sachet, 0.311744020749709",Maple almond  Butter (Justin's),"Beans, Peas, Legumes, Nuts, Seeds",227,10.94,0.050618706,0.01415972,0,0.013106015,0.048095596,0.001846227,0.002479247,0,0.005283478,0,0,0,0.000352896,0,
"Milk, soy, NA, carton",0.896893065,"Milk, soy, NA, carton, 89.6893064685875",Soy milk,"Beans, Peas, Legumes, Nuts, Seeds",228,10.43,0.017092346,0.003091249,0.004477316,0,0.000224154,0,3.69E-05,0,0.000127131,0,0,0.000213741,0,0.000162187,
"Milk, almond, NA, carton",0.853253547,"Milk, almond, NA, carton, 85.3253546941346",Almond milk,"Beans, Peas, Legumes, Nuts, Seeds",229,10.055,0.00208424,0.003714593,0.000242865,0.000438772,0.004010287,0.000173308,0.000886936,0.000327538,0.000304059,0,0,0.001322332,0,3.30E-05,
"Milk, rice, NA, carton",0.890982233,"Milk, rice, NA, carton, 89.0982233442654",Rice milk,Grain Products,230,9.99,0.089282389,0,0,0,0.000123081,0,3.39E-06,0,1.20E-06,0,0,0.000151426,0,0,
"Juice, mango, NA, bottled",0.870145148,"Juice, mango, NA, bottled, 87.0145148322119",Mango juice,Fruits,231,10.14,0.035537897,0.001262968,0.022411129,0.000602527,0.001251151,0.000287369,0.000148294,0,0.001945615,0,0,0,0,4.40E-05,
"Juice, carrot, NA, bottled",0.939261255,"Juice, carrot, NA, bottled, 93.9261255192545",Carrot juice,Vegetables,232,10.01,0.021367465,0.000908895,0.006890932,3.24E-05,0.000384841,0,7.14E-05,0,0.000975221,0,0,0,0,3.64E-05,
"Juice, beet, NA, bottled",0.875767639,"Juice, beet, NA, bottled, 87.5767639473831",Beet juice,Vegetables,233,10.31,0.0463542,0.000217282,0.018534971,2.62E-05,0.000275672,0,2.99E-05,2.17E-05,0.000184734,6.99E-05,2.82E-05,0,0,6.94E-05,
"Juice, vegetable, NA, can",0.940431336,"Juice, vegetable, NA, can, 94.0431336344204",Vegetable juice,Vegetables,234,10.26,0.009474277,0.001139549,0.0004999,0.00086446,0.000389579,0,8.48E-05,0,0.001340116,0,0,0.000390473,0,0,
"Juice, apple, NA, carton",0.982552062,"Juice, apple, NA, carton, 98.255206184149",Apple juice,Fruits,235,11,0.004102586,3.92E-05,0.003207367,6.33E-05,7.91E-05,0,9.68E-06,0,0.000227835,0,0,0,0,3.30E-06,
"Juice, orange, NA, bottled",0.903047893,"Juice, orange, NA, bottled, 90.3047893030104",Pulp free orange juice,Fruits,236,10.4,0.035083186,0.000392559,0.013238132,6.48E-05,0.000263225,0,0.000148531,1.67E-05,0.000283585,7.51E-05,3.02E-05,0,0,1.85E-05,
"Juice, orange, NA, bottled",0.968508697,"Juice, orange, NA, bottled, 96.850869689193",High pulp orange juice,Fruits,237,9.6,0.007856419,0.000900179,0.003080826,0.000340264,0.001146976,0.000111983,0.000288303,0,0.002055091,0,0,0.00012987,0,2.00E-05,
"Milk, chocolate, NA, carton",0.831944303,"Milk, chocolate, NA, carton, 83.1944302811744",Lowfat chocolate milk ,Milk and Milk Products,238,10.17,0.036627403,0.024356648,0,1.70E-05,0.000128731,0,2.86E-05,0,7.31E-05,0,0,0.000194104,0,0,
"Milk, whole, NA, carton",0.889783057,"Milk, whole, NA, carton, 88.978305679063",Whole milk,Milk and Milk Products,239,10.05,0.017441941,0.019354205,0,4.47E-06,2.72E-05,0,4.88E-06,0,2.16E-06,0,0,0.000125096,0,6.03E-05,
"Milk, whole, NA, carton",0.876414016,"Milk, whole, NA, carton, 87.6414016002523",Lactose-free whole milk,Milk and Milk Products,240,10.07,0.006403855,0.013973002,0,1.78E-06,7.09E-06,0,5.73E-06,0,0,0,0,0,0,0,
"Milk, oat, NA, carton",0.909187445,"Milk, oat, NA, carton, 90.9187444950239",Oat milk,Grain Products,241,10.09,0.044914346,0,0,0.000205963,0.000299227,0,2.24E-05,0,4.81E-06,0,0,0.000190252,0,0,
"Yogurt, greek, 0% non fat milk, cup",0.846819196,"Yogurt, greek, 0% non fat milk, cup, 84.6819196428571",Non fat greek yogurt,Milk and Milk Products,242,10.35,0.014500095,0.021357999,0,2.79E-05,4.79E-05,3.71E-05,0.000192395,0,6.33E-06,0,0,2.31E-05,0.000179528,0,
"Yogurt, greek, 0% non fat milk, cup",0.791167764,"Yogurt, greek, 0% non fat milk, cup, 79.1167764473719",Blueberry greek yogurt,Milk and Milk Products,243,10.28,0.04994557,0.016589215,0.019168293,0.000186696,0.000192961,4.78E-05,0.000153701,0,0.000604778,0,0,0.000242872,0.000108802,0,
"Cheese, cottage, NA, cup",0.769901523,"Cheese, cottage, NA, cup, 76.9901523440788",Cottage cheese,Milk and Milk Products,244,10.34,0.01930066,0.020758334,0.005657661,3.54E-05,4.58E-05,0,8.97E-05,0,0,0,0,0.000142891,0.00011597,0,
"Cheese, mozzarella, NA, packed",0.478410526,"Cheese, mozzarella, NA, packed, 47.841052616969",Low Moisture part Skim Mozarella cheese,Milk and Milk Products,245,10.32,0.001742109,0.004023541,5.48E-05,2.07E-05,9.02E-06,8.87E-05,8.55E-05,0,0,0,0,0,0,0.000191423,
"Tofu, sprouted, NA, packed",0.794747095,"Tofu, sprouted, NA, packed, 79.4747094780681",Sprouted tofu,"Beans, Peas, Legumes, Nuts, Seeds",246,10.42,0.002486844,0.003120665,0,0.000144498,0.000755946,0,0.000298438,0,0.000513748,0,0,0.001154342,0,0.000327378,
"Tofu, commercial product, packed",0.817219972,"Tofu, commercial product, packed, 81.7219971770538",Commercial tofu,"Beans, Peas, Legumes, Nuts, Seeds",247,10.46,0.014139497,0.007900301,0,0.01173722,0.006391635,0.000624559,0.001087541,0,0.006955511,0,0,0.001133785,0.000857787,0,
"Hummus, classic, NA, pre-cooked",0.563691491,"Hummus, classic, NA, pre-cooked, 56.369149062661",Classic hummus,"Beans, Peas, Legumes, Nuts, Seeds",248,10.14,0.201533082,0.013004175,0,0.002348212,0.009225743,0.000362572,0.000664498,0,0.002364356,0,0,0.010839212,0.000322432,0,
"Hummus, roasted red pepper, NA, pre-cooked",0.421463952,"Hummus, roasted red pepper, NA, pre-cooked, 42.146395242917",Roasted red pepper hummus,"Beans, Peas, Legumes, Nuts, Seeds",249,11.256,0.087465972,0.008748622,0.001662713,0.001349146,0.008276537,0.000359849,0.000502169,7.64E-05,0.001065085,0,0,0.005236908,0,0.000260341,
"Hummus, roasted pine nut, NA, pre-cooked",0.567205387,"Hummus, roasted pine nut, NA, pre-cooked, 56.7205387205387",Roasted pine nut hummus,"Beans, Peas, Legumes, Nuts, Seeds",250,10.08,0.088864419,0.011151386,0,0.001078524,0.00911855,0,0.000682084,0,0.002540504,0,0,0.002199895,0,0.000367443,
"Spread, almond, NA, sachet",0.004225947,"Spread, almond, NA, sachet, 0.422594731652361",Cinnamon Almond Butter,"Beans, Peas, Legumes, Nuts, Seeds",251,10.02,0.045294774,0.015062078,0,0.020506971,0.05755574,0.002181741,0.003063001,0,0.006580075,0,0,0.000428183,0.000290766,0,
"Cookies, chocolate chip, NA, packed",0.019238749,"Cookies, chocolate chip, NA, packed, 1.92387491040779",Chocolate chip cookies,Grain Products,252,10.04,0.678750535,0.005687434,0.01645227,0.005365745,0.005747261,0,0.000107884,0,0.00050215,0,0,0,6.24E-05,0,
"Cookies, vanilla, NA, packed",0.012876655,"Cookies, vanilla, NA, packed, 1.28766551975812",Vanilla cookies,Grain Products,253,10.08,0.529796996,0.00308476,0.006790421,0.002707679,0.005833899,0.000951587,1.69E-05,0,0,0,0,0.000965407,0,0.000296137,
"Cereal, rice, NA, packed",0.002433697,"Cereal, rice, NA, packed, 0.243369734789379",Rice cereals,Grain Products,254,10.04,0.823122881,0.003689,0.001788636,0.003688003,0.004020192,0,9.23E-05,0,2.93E-05,0,0,0,0.000302263,0,
"Cereal, corn, NA, packed",0.014738025,"Cereal, corn, NA, packed, 1.47380253543996",Corn cereal (corn flakes),Grain Products,255,10.49,0.694029373,0.002992241,0,0.001213843,0.002412907,0,2.47E-05,0,5.77E-05,0,0,0,0.00E+00,0,
"Cereal, multi-grain, NA, packed",0.025662066,"Cereal, multi-grain, NA, packed, 2.5662066393138",Multi grain cereal,Grain Products,256,10.03,0.560269645,0.006658625,0.036573723,0.007050309,0.006957747,0,6.99E-05,0,0.000289378,0,0,0,0.000252354,0,
"Cereal, oat, NA, packed",0.018627216,"Cereal, oat, NA, packed, 1.86272160996637",Whole grain oat cereal,Grain Products,257,10.48,0.611225467,0.010656727,0.033348029,0.003322928,0.004604601,0,4.26E-05,0,0.000316002,0,0,0,0.000477929,0,
"Cereal, oat, NA, packed",0.016862698,"Cereal, oat, NA, packed, 1.68626980316852",Hone nut oat cereal,Grain Products,258,10.22,0.701337708,0.009108767,0.066238876,0.012818144,0.010547097,0,0.000140589,0,0.000713758,0,0,0.000673449,0.000359828,0,
"Flour, commercial product, packed",0.089828995,"Flour, commercial product, packed, 8.98289952613138",7 grain pancake/waffle flour,Grain Products,259,10.15,0.471272894,0.003183778,0.004252319,0.013377693,0.019438522,0.000415948,5.20E-05,0.0001611,0.000121053,0,0,0.001286072,0,0.000408667,
"Flour, almond, NA, packed",0.045315523,"Flour, almond, NA, packed, 4.53155233755693",Almond flour,"Beans, Peas, Legumes, Nuts, Seeds",260,10.37,0.016503631,0.004611126,0.001143712,0.003585795,0.02889639,0.001016739,0.000676871,0,0.001789079,0,0,0.000623409,0,0.000340822,
"Flour, commercial product, packed",0.066411064,"Flour, commercial product, packed, 6.64110639463231",Baking flour,"Beans, Peas, Legumes, Nuts, Seeds",261,10.02,0.273938334,0.004060178,0.003936011,0.001519883,0.017262993,0.000892511,0.000458392,9.34E-05,0.000928921,0,0,0.020566031,0,0.000306217,
"Flour, hazelnut, NA, packed",0.000193949,"Flour, hazelnut, NA, packed, 0.0193948797517003",Hazelnut flour,"Beans, Peas, Legumes, Nuts, Seeds",262,10.24,0.029031368,0.005417949,0.002552505,0.001938624,0.016705759,0.000883829,0.000654873,1.00E-04,0.00128875,0,0,0.000406921,0,0.00036093,
"Flour, commercial product, packed",0.072747329,"Flour, commercial product, packed, 7.2747329307943",Buttermilk pancake/waffle flour,Grain Products,263,10.06,0.7052452,0.033688017,0,0.017130066,0.014278764,0,0,0,6.40E-05,0,0,0.001645873,0.000282812,0,
"Flour, coconut, NA, packed",0.023341937,"Flour, coconut, NA, packed, 2.33419369318814",Coconut flour,"Beans, Peas, Legumes, Nuts, Seeds",264,10.47,0.053719123,0.051875193,0,0.016777032,0.01401309,0,0.001212033,0.000480516,0.003196602,0,0,0.430904467,0.000189472,0,
"Flour, soy, NA, packed",0.068916686,"Flour, soy, NA, packed, 6.89166863346703",Soy flour,"Beans, Peas, Legumes, Nuts, Seeds",265,10.19,0.019675653,0.115503678,0,0.013347079,0.038180933,0.005754095,0.003276482,0.001017674,0.005424491,0,0,0.01009853,0.001546529,0,
"Xanthan gum, commercial product, packed",0.076624971,"Xanthan gum, commercial product, packed, 7.66249712224695",Xanthan gum,Grain Products,266,9.952,0.192430433,0.000952,0.002563289,0.000605734,0.00140076,0.000462611,0.002069283,0.014901426,0.001036027,0,0,0.13390323,0,0.000202219,
"Bean, pinto, NA, canned",0.758009574,"Bean, pinto, NA, canned, 75.8009573973199",Canned low sodium pinto bean,"Beans, Peas, Legumes, Nuts, Seeds",267,10.33,0.086175211,0.001554305,0.000880361,0.001648439,0.007682228,0.000329833,0.000127287,0.000124383,0.000312894,0,0,0.000778483,0,0.000144226,
"Bean, black, NA, canned",0.769477041,"Bean, black, NA, canned, 76.9477040651666",Canned black beans (S&W),"Beans, Peas, Legumes, Nuts, Seeds",268,10.15,0.087780838,0.002259125,0.000812132,0.001765345,0.015645593,0.000423932,0.000133703,0.000120794,0.000402032,0,0,0.001059714,0,0.000153298,
"Bean, garbanzo, NA, canned",0.746685163,"Bean, garbanzo, NA, canned, 74.6685162707358",Canned garbanzo beans,"Beans, Peas, Legumes, Nuts, Seeds",269,10.11,0.099086885,0.003145157,0.000723214,0.000554,0.012797719,0.000186186,0.000194546,3.50E-05,0.000344255,0,0,0.000195812,0,0.000151736,
"Bean, black, NA, canned",0.752452421,"Bean, black, NA, canned, 75.2452421476095",Canned black beans (Organics),"Beans, Peas, Legumes, Nuts, Seeds",270,10.32,0.071353609,0.001811058,0.000623077,0.00166451,0.013383165,0.000444595,0.000147043,0.000105455,0.000432218,0,0,0.000886468,0,0.000150014,
"Bean, kidney, NA, canned",0.675707953,"Bean, kidney, NA, canned, 67.5707953100522",Canned Kidney beans,"Beans, Peas, Legumes, Nuts, Seeds",271,9.759,0.106097332,0.00612458,0.001327652,0.003090179,0.009920418,0.000915801,0.000344398,0.000158255,0.001276738,0,0,0.002087468,0,0.000150472,
"Bean, blackeye, NA, canned",0.738979872,"Bean, blackeye, NA, canned, 73.8979871582137",Canned Blackeye beans,"Beans, Peas, Legumes, Nuts, Seeds",272,10.23,0.111643529,0.001762408,0.000662208,0.000692225,0.008937851,0.000256322,0.000197592,9.08E-05,0.000397012,0,0,0.000282424,0,0.000155046,
"Bean, butter, NA, canned",0.723070759,"Bean, butter, NA, canned, 72.307075887491",Canned Butter beans,"Beans, Peas, Legumes, Nuts, Seeds",273,10.11,0.080185139,0.001808071,0.000613121,0.001932135,0.012688621,0.000278314,0.000181112,9.00E-05,0.000559674,0,0,0.003459954,0,0.000146772,
"Artichoke, NA, hearts, canned",0.814062533,"Artichoke, NA, hearts, canned, 81.4062533355155",Canned Artichoke hearts,Vegetables,274,10.033,0.015147396,0.004223012,0.005468607,0.001189256,0.003967906,0.000313491,0.000644459,4.02E-05,0.00534626,0,0,0.000632373,0,0.000260127,
"Bean, garbanzo, NA, canned",0.668851978,"Bean, garbanzo, NA, canned, 66.8851978064138",Canned garbanzo beans (S&W),"Beans, Peas, Legumes, Nuts, Seeds",275,10.38,0.14009482,0.002880325,0.000832506,0.000655342,0.016891861,0.000492748,0.000251672,5.03E-05,0.000537122,0,0,0.000290417,0,0.000169217,
"Corn, NA, polenta, pre-cooked",0.81841425,"Corn, NA, polenta, pre-cooked, 81.8414250393347",Corn polenta ,Grain Products,276,10.48,0.061993193,0.002375868,0.023813518,0.001461765,0.003033572,0.000283455,0.000267294,0,0.002008883,0,0,0,0.000421097,0,
"Apple sauce, commercial product",0.821959875,"Apple sauce, commercial product, 82.1959875130919",Original apple sauce (Tree top),Fruits,277,10.11,0.03768878,0.002502532,0.033265373,0.002718139,0.002382711,0.000697205,0.000349849,0,0.004168631,0,0,9.60E-05,0,4.79E-05,
"Apple sauce, commercial product",0.839978755,"Apple sauce, commercial product, 83.9978755477104",No added sugar apple sauce (Tree top),Fruits,278,10.16,0.02794211,0.002077876,0.015574548,0.00165574,0.002576662,0,0.000214588,0,0.002984396,0,0,0.000221469,0,0,
"Apple sauce, commercial product",0.8625783,"Apple sauce, commercial product, 86.2578299531298",No added sugar apple sauce (Motts),Fruits,279,10.1,0.026322027,0.001383562,0.021631275,0.001382187,0.00129465,0,9.21E-05,0,0.001828533,0,0,4.10E-05,0,0,
"Apple sauce, commercial product",0.855939739,"Apple sauce, commercial product, 85.5939739051625",No added sugar mixed berry apple sauce (Motts),Fruits,280,10.14,0.028401048,0.001298271,0.018623822,0.001065758,0.001915137,0,0.000117841,0,0.002077349,0,0,0.00023309,0,0,
"Apple sauce, commercial product",0.848430868,"Apple sauce, commercial product, 84.8430867719713",No added sugar strawberry apple sauce (Motts),Fruits,281,9.91,0.03777224,0.001846264,0.029526425,0.001969035,0.001627549,0.000449099,0.000194918,0,0.002529234,0.000114738,4.62E-05,0.000182338,0,5.05E-05,
"Mac & Cheese, commercial product, pre-cooked",0.740145003,"Mac & Cheese, commercial product, pre-cooked, 74.0145002550485",Commercial Mac and Cheese,Vegetables,282,10.24,0.131518591,0.005155783,0.005255048,0.00021516,0.002302575,0,0.000174882,0,0.001646181,0,0,0.000596367,0,0,
"Oatmeal & Sprouted quinoa, commercial product, pre-mixed",0.630627602,"Oatmeal & Sprouted quinoa, commercial product, pre-mixed, 63.0627602079077",Oatmeal & Sprouted quinoa w/ banana and strawberries,Grain Products,283,10.11,0.162211735,0.004223404,0.020589556,0.001755627,0.002610355,0,0.000154398,0,0.002054449,0,0,0.002680166,0,0,
"Oatmeal & Sprouted quinoa, commercial product, pre-mixed",0.673489339,"Oatmeal & Sprouted quinoa, commercial product, pre-mixed, 67.3489339286495",Oatmeal & Sprouted quinoa w/ apple and blueberry,Grain Products,284,10.36,0.167565271,0.006053181,0.013319349,0.003606963,0.003604025,0,0.000183826,0,0.001751403,0,0,0.002919985,0,0,
"Ravioli, commercial product, pre-cooked",0.712584312,"Ravioli, commercial product, pre-cooked, 71.2584312159862",Sqash and pumpkin ravioli w/ sage sauce,Grain Products,285,10.37,0.180558846,0.005341621,0.001560092,0.004009161,0.003260731,0,0.000143708,0,0.001904416,0,0,0.000875181,0,0,
"Ravioli, commercial product, pre-cooked",0.639443925,"Ravioli, commercial product, pre-cooked, 63.9443925119512",Spinach and Cheese ravioli w/ Marinara sauce,Grain Products,286,10.29,0.203869221,0.005957107,0.004704175,0.009108368,0.007660735,0,0.000265009,0,0.003226256,0,0,0.000728323,0,0,
"Fruit & Veggie blend, commercial product, pouch",0.692248284,"Fruit & Veggie blend, commercial product, pouch, 69.2248283646652",Organic Happy Tots 287,Fruits,287,9.628,0.036438111,0.002638048,0.044136828,0.002337374,0.005549071,9.32E-05,0.000377304,0.000161877,0.004287905,0,0,-8.00E-05,0,0.000213887,
"Fruit & Veggie blend, commercial product, pouch",0.814615957,"Fruit & Veggie blend, commercial product, pouch, 81.4615957046722",Organic Happy Tots 288,Fruits,288,10.15,0.05042928,0.004174663,0.021657676,0.012881781,0.003340435,0,0.000295502,0,0.002955022,0,0,0.000208001,0,0,
"Fruit & Veggie blend, commercial product, pouch",0.820929018,"Fruit & Veggie blend, commercial product, pouch, 82.0929018311059",Organic Happy Tots 289,Fruits,289,9.92,0.027866489,0.002621778,0.018296936,0.002210631,0.004392969,0,0.000182652,0,0.002635567,0,0,0.000189636,0,0,
"Fruit & Veggie blend, commercial product, pouch",0.821326655,"Fruit & Veggie blend, commercial product, pouch, 82.1326654974585",Organic Happy Tots 290,Fruits,290,10.29,0.025805255,0.003040127,0.017206958,0.002808388,0.004748065,0,0.000254073,0,0.003946001,0,0,0.000245676,0,0,
"Fruit & Veggie blend, commercial product, pouch",0.796817327,"Fruit & Veggie blend, commercial product, pouch, 79.6817327111916",Organic Happy Tots 291,Fruits,291,10.07,0.018548953,0.001895085,0.017763042,0.001231084,0.003864331,0,0.000200541,0,0.003459185,0,0,0,0,0,
